Headline,Published Date
"Reliance Jio Chairman Akash Ambani, OnlyFans' CEO Amrapali Gan among TIME100 Next list of rising stars - The Economic Times","Wed, 28 Sep 2022 07:00:00 GMT"
Reliance Retail launches fashion & lifestyle chain Reliance Centro - Mint,"Tue, 27 Sep 2022 07:00:00 GMT"
Reliance’s Retail Unit Launches In-House Fashion Store Azorte in Bangalore - Equitypandit,"Thu, 29 Sep 2022 07:00:00 GMT"
"Reliance, ONGC, Indian Oil shares slip after hike in windfall tax on crude - CNBC TV18","Thu, 01 Sep 2022 07:00:00 GMT"
RIL acquires 79.4% stake in software-based management tools developer SenseHawk for $32 mn - Business Today,"Tue, 06 Sep 2022 07:00:00 GMT"
Akash Ambani only Indian on TIME's rising stars list - Fortune India,"Thu, 29 Sep 2022 07:00:00 GMT"
Reliances Retail Formats Are Still Unprofitable - NDTV Profit,"Thu, 01 Sep 2022 07:00:00 GMT"
CCI approves merger of Jio Cinema OTT platform with Viacom18 - Business Today,"Thu, 22 Sep 2022 07:00:00 GMT"
"Reliance Jio likely to price 5G smartphone between ₹8,000 and ₹12,000 - Fortune India","Tue, 27 Sep 2022 07:00:00 GMT"
Reliance Retail launches new premium fashion and lifestyle brand AZORTE - The Hindu,"Thu, 29 Sep 2022 07:00:00 GMT"
"Desi cold drink ‘Campa Cola’ to make a comeback, Reliance Industries acquires the brand to relaunch during Diwali - OpIndia","Thu, 01 Sep 2022 07:00:00 GMT"
Reliance Retail Ventures Acquires Majority Stake in Insight Cosmetics - BeautyMatter,"Mon, 19 Sep 2022 07:00:00 GMT"
Reliance Retail in talks for rights of beauty retailer Sephora: Report - Hindustan Times,"Wed, 21 Sep 2022 07:00:00 GMT"
"Campa Cola, Insight Cosmetics to Big Cola, Aakash Namkeen: Reliance Retail spreading its wings by tying up with FMCG brands - Business Today","Sat, 10 Sep 2022 07:00:00 GMT"
Reliance Jio to launch a different kind of fixed wireless access - Fierce Network,"Tue, 06 Sep 2022 07:00:00 GMT"
Reliance Retail launches first in-house premium fashion store called Azorte - Jammu Links News,"Thu, 29 Sep 2022 07:00:00 GMT"
Reliance New Energy to invest in Caelux Corporation - Construction Week India,"Tue, 27 Sep 2022 07:00:00 GMT"
"Reliance Retail to invest in Big Cola, Aakash Namkeen - Mint","Fri, 09 Sep 2022 07:00:00 GMT"
NOT Reliance or TCS...This could be India's First Trillion Dollar Stock - Equitymaster,"Thu, 08 Sep 2022 07:00:00 GMT"
Reliance Industries Limited to acquire majority stake in SenseHawk - PSU Connect,"Tue, 06 Sep 2022 07:00:00 GMT"
Adani v Ambani: the battle of the tycoons - The Economist,"Thu, 01 Sep 2022 07:00:00 GMT"
"As first production draws near, new FPSO sails away to India’s deepwater gas project - Offshore-Energy.biz","Fri, 02 Sep 2022 07:00:00 GMT"
'Talent hard to find': What the Ambani-Adani 'no-poaching pact' really means - Business Today,"Mon, 26 Sep 2022 07:00:00 GMT"
"Rs 8,000 crore invested in the Model Economic Township Limited’s integrated industrial township in... - Moneycontrol","Mon, 26 Sep 2022 07:00:00 GMT"
Reliance Jio v/s Bharti Airtel: Who will win the 5G war? - Communications Today,"Fri, 02 Sep 2022 07:00:00 GMT"
"In-depth: Nostalgia, nationalism, or price, how Campa will help Reliance's entry into FMCG space - bestmediainfo.com","Mon, 05 Sep 2022 07:00:00 GMT"
Explained: Reliance versus Adani in green hydrogen - The Morning Context,"Thu, 08 Sep 2022 07:00:00 GMT"
Akash Ambani Named in Time100 NEXT list; Here's Why The Reliance Jio Chairman Is The Next Big Thing - News18,"Thu, 29 Sep 2022 07:00:00 GMT"
All eyes on Mukesh Ambani and Gautam Adani to deliver India’s green goals - Mint,"Sat, 10 Sep 2022 07:00:00 GMT"
Top 10 in broadband? India needs to go from 1.95% to 40% adoption - Business Standard,"Sun, 04 Sep 2022 07:00:00 GMT"
�Bindu� softdrink turns down Reliance takeover offer; Bindu brand to expand market - mangaloretoday.com,"Wed, 07 Sep 2022 07:00:00 GMT"
Reliance-BP to get 'Ruby' from South Korea to ramp up domestic gas production - The Economic Times,"Sun, 04 Sep 2022 07:00:00 GMT"
Adani Wilmar eyes acquisitions to push food business - The Indian Express,"Thu, 15 Sep 2022 07:00:00 GMT"
India's 7 Most Favourite Stocks - Equitymaster,"Sat, 17 Sep 2022 07:00:00 GMT"
Anand Pillai joins TIL Group as Chief Transformation Officer - ETHRWorld.com,"Sat, 17 Sep 2022 07:00:00 GMT"
"Reliance acquires Shubhalakshmi Polyesters for Rs 1,592 crore - Trade Brains","Sat, 10 Sep 2022 07:00:00 GMT"
"Reliance Retail launches first store of Centro in Vasant Kunj, Delhi - ThePrint","Tue, 27 Sep 2022 07:00:00 GMT"
RIL chairman donates â‚¹1.5 crore to Tirumala temple - Deccan Chronicle,"Fri, 16 Sep 2022 07:00:00 GMT"
Breakingviews - Mukesh Ambani pulls off one shade of overseas M&A - Reuters,"Sun, 18 Sep 2022 07:00:00 GMT"
Campa Cola set to compete in aerated drinks space with new owner Reliance - Business Standard,"Thu, 01 Sep 2022 07:00:00 GMT"
Mukesh Ambani visits Tirumala temple ahead of Reliance Jio's 5G rollout - India TV News,"Fri, 16 Sep 2022 07:00:00 GMT"
Reliance Industries to restructure group EPC resources - pv magazine India,"Sat, 22 Oct 2022 07:00:00 GMT"
Reliance Industries to restructure group EPC resources. Details Here - Mint,"Fri, 21 Oct 2022 07:00:00 GMT"
"Reliance Industries, Jio in talks to raise funds through foreign loans - Business Standard","Mon, 10 Oct 2022 07:00:00 GMT"
Ambri and Reliance Industries Expand Strategic Alliance to Accelerate Commercialization of Ambri Batteries in India - Business Wire,"Tue, 18 Oct 2022 07:00:00 GMT"
India's Reliance Jio posts 28% rise in Q2 profit - Reuters,"Fri, 21 Oct 2022 07:00:00 GMT"
Windfall tax on fuel exports hits Reliance Industries Ltd profits in Q2 - The New Indian Express,"Sat, 22 Oct 2022 07:00:00 GMT"
"RIL announces demerger of financial services undertaking, to list Jio Financial Services - Business Today","Fri, 21 Oct 2022 07:00:00 GMT"
"Preview: RIL’s Q2 consolidated net profit seen rising 12% YoY, driven by telecom, retail business - Moneycontrol","Thu, 20 Oct 2022 07:00:00 GMT"
Reliance Industries buoyed by retail biz and Jio's positive showing - CNBC TV18,"Fri, 21 Oct 2022 07:00:00 GMT"
Ambri delivering liquid metal battery system to Reliance in pilot project - Energy-Storage.News,"Wed, 19 Oct 2022 07:00:00 GMT"
Reliance Industries’ REC Group lands PV equipment supply deal with Maxwell Technologies for HJT modules - PV Tech,"Thu, 13 Oct 2022 07:00:00 GMT"
Reliance to demerge financial service biz; list Jio Financial Services - Fortune India,"Fri, 21 Oct 2022 07:00:00 GMT"
"Media Release Closing the gender digital divide: Reliance Foundation, USAID invite grant applications for WomenConnect Challenge India Round Two ● WomenConnect Challenge India aims to empower women through digital technology. ● Over 3 lakh w - Facebook","Wed, 12 Oct 2022 07:00:00 GMT"
Reliance Industries To Demerge EPC Resources Business - outlookbusiness.com,"Sat, 22 Oct 2022 07:00:00 GMT"
Board of Reliance Industries Ltd to restructure group EPC resources - Business Standard,"Sat, 22 Oct 2022 07:00:00 GMT"
Reliance Industries subsidiary bumps up stake in US-based SkyTran - Moneycontrol,"Sat, 29 Oct 2022 07:00:00 GMT"
Reliance Industries likely to clock 5% rise in quarterly revenue - CNBC TV18,"Fri, 21 Oct 2022 07:00:00 GMT"
Reliance Industries to demerge and list financial services business - Business Standard,"Fri, 21 Oct 2022 07:00:00 GMT"
"Reliance, Sanmina completes JV deal to build manufacturing hub in India - Business Standard","Tue, 04 Oct 2022 07:00:00 GMT"
Reliance Retail to expand biz in affordable toy segment through Rowan brand - Business Standard,"Tue, 25 Oct 2022 07:00:00 GMT"
"Reliance Retail earnings beat driven by revival in footfalls, digital integration - CNBC TV18","Fri, 21 Oct 2022 07:00:00 GMT"
"Reliance to restructure EPC operations, merge group with self to synergize capabilities - The Economic Times","Fri, 21 Oct 2022 07:00:00 GMT"
Reliance Jio strikes JV for domestic equipment manufacturing - Developing Telecoms,"Wed, 05 Oct 2022 07:00:00 GMT"
"India's Reliance Industries increases prices of PTA, MEG & MELT - Fibre2Fashion","Fri, 07 Oct 2022 07:00:00 GMT"
Ambani sets up family office branch in Singapore - The Indian Express,"Sat, 08 Oct 2022 07:00:00 GMT"
"The Battle For $20 Billion Indian Diagnostics Sector: As Tatas, Reliance, Adani Fight It Out, Sector Is Heading Towards Consolidation - Swarajyamag","Wed, 26 Oct 2022 07:00:00 GMT"
RIL to open country's first multi-disciplinary cultural centre in Mumbai in March 2023 - Moneycontrol,"Thu, 06 Oct 2022 07:00:00 GMT"
RIL unit forms JV with US-based Sanmina to set up electronics manufacturing facility - Fortune India,"Tue, 04 Oct 2022 07:00:00 GMT"
Report: Reliance Industries' New FPSO in Collision Incident Off India - Offshore Engineer Magazine,"Mon, 10 Oct 2022 07:00:00 GMT"
PGCIL board approves dedicated line for Reliance Industries in Gujarat - T&D India,"Mon, 03 Oct 2022 07:00:00 GMT"
Reliance Retail partners with 50+ traditional sweets makers - The Economic Times,"Wed, 19 Oct 2022 07:00:00 GMT"
How Reliance Shareholders Will Be Rewarded With Jio Financial Services Shares After Demerger - outlookbusiness.com,"Wed, 26 Oct 2022 07:00:00 GMT"
Reliance Industries Ltd to ignite fintech arena - Telegraph India,"Wed, 26 Oct 2022 07:00:00 GMT"
Reliance Power share jumps after BlackRock fund buys stake - Mint,"Fri, 07 Oct 2022 07:00:00 GMT"
Reliance Becomes First Indian Company To Post Earnings Call On Metaverse - outlookbusiness.com,"Sat, 22 Oct 2022 07:00:00 GMT"
Green panel nod to Reliance Hazira manufacturing complex’s Rs 10k cr expansion - PSU Watch,"Thu, 20 Oct 2022 07:00:00 GMT"
"Reliance, Sanmina complete deal to set up electronics manufacturing joint venture - Times of India","Tue, 04 Oct 2022 07:00:00 GMT"
"Reliance Brands and Aditya Birla Fashion and Retail are buying out top designers, corporatising Indian fashion - Business Today","Fri, 07 Oct 2022 07:00:00 GMT"
Why Did Reliance Shelve its E-Commerce Marketplace Plans? - marketfeed,"Mon, 17 Oct 2022 07:00:00 GMT"
Reliance quarterly revenue up 5% in line with Street estimates — oil-to-chemical unit under pressure - CNBC TV18,"Fri, 21 Oct 2022 07:00:00 GMT"
"Reliance and Adani are getting into diagnostics. So are Apollo Hospitals, Tata 1mg and many others. But why? - Business Today","Sun, 23 Oct 2022 07:00:00 GMT"
Reliance to demerge fin services arm Jio Financial Services; list it on stock exchanges - The Indian Express,"Fri, 21 Oct 2022 07:00:00 GMT"
Reliance Sole Bidder For Metro’s India Business: Report - outlookbusiness.com,"Thu, 13 Oct 2022 07:00:00 GMT"
"Reliance Retail likely to benefit from higher footfalls, acquisitions | Earnings Preview - CNBC TV18","Thu, 20 Oct 2022 07:00:00 GMT"
Adani vs Reliance vs Tata: Which group delivered better return in 2022 so far? - Business Today,"Mon, 03 Oct 2022 07:00:00 GMT"
"Reliance's brand new FPSO collides at the east coast, no one hurt - The Economic Times","Sun, 09 Oct 2022 07:00:00 GMT"
RIL to demerge and list financial services business as Jio Financial Services Ltd - Mint,"Fri, 21 Oct 2022 07:00:00 GMT"
"Mukesh Ambani, the second-richest person in Asia, joins the list of ultra-rich people opening a family office in Singapore - Business Insider","Fri, 07 Oct 2022 07:00:00 GMT"
"Jio 5G across India by December 2023, says Mukesh Ambani - The New Indian Express","Sat, 01 Oct 2022 07:00:00 GMT"
Reliance and BP’s brand new FPSO in collision offshore India - Upstream Online,"Fri, 07 Oct 2022 07:00:00 GMT"
"RIL Q2 profit flat at ₹15,512 cr on disruption in O2C biz - Fortune India","Fri, 21 Oct 2022 07:00:00 GMT"
"Work From Home Ends: Reliance Industries, Bharti Airtel, Other Firms Adopt Flexible Work Models For Employees - India.Com","Sat, 15 Oct 2022 07:00:00 GMT"
"Reliance, Sanmina Enters into Joint Venture to Build Manufacturing Hub in India - Equitypandit","Tue, 04 Oct 2022 07:00:00 GMT"
"Jio Financial Services, RIL to List a New Entity in Stock Markets Soon - TelecomTalk","Sun, 23 Oct 2022 07:00:00 GMT"
Billionaire Mukesh Ambani To Open Family Office In Singapore: Report - outlookbusiness.com,"Fri, 07 Oct 2022 07:00:00 GMT"
"Reliance Jio to launch 4G enabled low-cost laptop at ₹15,000: Sources - BusinessLine","Mon, 03 Oct 2022 07:00:00 GMT"
Reliance Retail net profit grows 36% in Q2; revenue up 44.5% YoY - Business Standard,"Fri, 21 Oct 2022 07:00:00 GMT"
JPMorgan names former Reliance M&A head as India investment banking chief - Business Standard,"Mon, 17 Oct 2022 07:00:00 GMT"
Reliance Profit (NSE:RIL) Surprises as Consumer Arms Offset Refining Blues - Bloomberg,"Fri, 21 Oct 2022 07:00:00 GMT"
India's Reliance Jio selects Nokia as equipment provider in 5G push - Reuters,"Mon, 17 Oct 2022 07:00:00 GMT"
"Reliance Jio teams up with Nokia, Ericsson to build 5G network - Fortune India","Mon, 17 Oct 2022 07:00:00 GMT"
"Reliance hospital, Ambani family receive threat calls | Mumbai news - Hindustan Times","Thu, 06 Oct 2022 07:00:00 GMT"
"Mukesh Ambani to list financial services, rejig engineering business - Times of India","Sat, 22 Oct 2022 07:00:00 GMT"
Have deployed a standalone 5G network to leapfrog ahead: Reliance Jio - Business Today,"Sun, 02 Oct 2022 07:00:00 GMT"
"Mukesh Ambani-led RIL’s subsidiary RSBVL, Sanmina announce completion of JV - Business Today","Tue, 04 Oct 2022 07:00:00 GMT"
Reliance Retail's brand partnerships increase three-fold in the past decade - Business Standard,"Wed, 12 Oct 2022 07:00:00 GMT"
Reliance’s MJ gas condensate field to begin output this year - Construction World,"Fri, 28 Oct 2022 07:00:00 GMT"
Meet the man who sold Ambani's NDTV stake to Adani - Newslaundry,"Thu, 13 Oct 2022 07:00:00 GMT"
Jio Platforms net profit up 27% in Q2FY23 - ET Telecom,"Fri, 21 Oct 2022 07:00:00 GMT"
"Reliance arm and Sanmina complete deal to set up electronics JV, to focus on 4G and 5G hardware - The Economic Times","Tue, 04 Oct 2022 07:00:00 GMT"
Billionaire Mukesh Ambani to Open Family Office in Singapore - Bloomberg,"Thu, 06 Oct 2022 07:00:00 GMT"
Aditya Birla Capital enters fray to pick up stake in Reliance Nippon Life - ET BrandEquity,"Fri, 14 Oct 2022 07:00:00 GMT"
"Natural gas price increase negative for GAIL, IGL, marginal beneficiary is RIL - ET EnergyWorld","Mon, 03 Oct 2022 07:00:00 GMT"
Authum Investment acquires Reliance Commercial Finance for Rs 1 crore - Business Standard,"Fri, 14 Oct 2022 07:00:00 GMT"
Reliance Industrial Infrastructure Q2 Consolidated Net Profit Falls 11.37% To Rs 2.26 Crore- News18 - News18,"Sun, 16 Oct 2022 07:00:00 GMT"
5G technology likely to reach across India by 2024: Telecom Service Providers - The New Indian Express,"Sun, 02 Oct 2022 07:00:00 GMT"
Reliance vs Small Manufacturers in MEG Anti-Dumping Tussle - NewsClick,"Fri, 21 Oct 2022 07:00:00 GMT"
"Quarterly Results: Q2FY23 Earnings of Reliance Industries, HUL, Others DECLARED! Check Net Proft and Other Financial Details - Zee Business","Sat, 22 Oct 2022 07:00:00 GMT"
Which are India's biggest tax paying companies? Find out here - Business Today,"Thu, 20 Oct 2022 07:00:00 GMT"
"Reliance Foundation, Mizoram Football Association team up to build children's league - Business Today","Mon, 31 Oct 2022 07:00:00 GMT"
"Diwali Muhurat Trading: Sensex, Nifty to open on subdued note; RIL, HUL, ICICI Bank shares eyed - Fortune India","Mon, 24 Oct 2022 07:00:00 GMT"
"RIL to demerge subsidiary RPPMSL's EPC business, combine it with its own - Business Standard","Fri, 21 Oct 2022 07:00:00 GMT"
Mukesh Ambani’s Reliance acquires US-based pod-transport firm as part of its green push - Free Press Journal,"Sat, 29 Oct 2022 07:00:00 GMT"
"India’s Reliance Industries increases prices of PTA, MEG & MELT - FashionNetwork India","Fri, 07 Oct 2022 07:00:00 GMT"
RIL Becomes First Indian Company to Post Earnings Call On Metaverse - Adda247,"Mon, 31 Oct 2022 07:00:00 GMT"
"Reliance Jio's tariff to remain affordable, existing subscribers to get opt-in 5G - ET Telecom","Mon, 03 Oct 2022 07:00:00 GMT"
Reliance chairman Mukesh Ambani to open family office in Singapore: Report - India Today,"Fri, 07 Oct 2022 07:00:00 GMT"
"Mukesh Ambani buys ₹1,350 crore mansion at Dubai's Palm Jumeirah: Report - Hindustan Times","Wed, 19 Oct 2022 07:00:00 GMT"
Ambani Threat Call: Mumbai Police Detains One Person From Bihar - HW News English,"Thu, 06 Oct 2022 07:00:00 GMT"
Reliance Jio drops these recharge plans offering Disney+Hotstar subscription - Hindustan Times,"Fri, 14 Oct 2022 07:00:00 GMT"
"From Reliance to Adani to hospitals, pharma companies & even start-ups, everyone's eyeing this new pot of gold - Business Today","Tue, 18 Oct 2022 07:00:00 GMT"
"Jio-bp to set up EV charging network at M&M dealerships, workshops - ET Auto","Thu, 13 Oct 2022 07:00:00 GMT"
MoEF panel nod to RIL’s Hazira manufacturing complex’s Rs 10k cr expansion - Construction Week India,"Mon, 24 Oct 2022 07:00:00 GMT"
Reliance Industries Ltd. to restructure group EPC resources - DeshGujarat,"Sat, 22 Oct 2022 07:00:00 GMT"
"Reliance Jio net profit rises 28% YoY to Rs 4,518 crore in Q2 - The Statesman","Fri, 21 Oct 2022 07:00:00 GMT"
"Akash Ambani Touches PM Modi's Feet To Seek Blessings At 5G Launch Event, His Simplicity Wins Hearts - BollywoodShaadis","Mon, 03 Oct 2022 07:00:00 GMT"
"Sanjiv Bhasin stocks on Zee Business: Buy Reliance, Tata Consumer - check price targets - Zee Business","Tue, 11 Oct 2022 07:00:00 GMT"
Mukesh Ambani takes Dubai! Inside the UAE’s most expensive property deal - South China Morning Post,"Tue, 25 Oct 2022 07:00:00 GMT"
"Mukesh Ambani, Wife Nita Get 'Life Threat' in Call to Reliance Foundation Hospital, Police Initiate Probe - India.Com","Wed, 05 Oct 2022 07:00:00 GMT"
Reliance Jio Promises To Bring 5G To Every Indian By December 2023 - ABP Live English,"Sat, 01 Oct 2022 07:00:00 GMT"
"Reliance Industries, HCL may enter Indian semiconductor race via ISMC - ET Telecom","Tue, 08 Nov 2022 08:00:00 GMT"
Reliance Industries appoints KV Kamath as independent director for 5 years - Business Today,"Fri, 04 Nov 2022 07:00:00 GMT"
"Reliance Industries, Rosneft-Backed Nayara Energy To Benefit From European Energy Crisis: Report - Swarajyamag","Mon, 14 Nov 2022 08:00:00 GMT"
Reliance Industries Shares Soar 3% to Five-Month High - Equitypandit,"Mon, 28 Nov 2022 08:00:00 GMT"
"Reliance Industries India's best employer, in top 20 worldwide: Forbes - Business Standard","Sun, 06 Nov 2022 07:00:00 GMT"
Reliance's Brand Empire - Finshots,"Wed, 30 Nov 2022 08:00:00 GMT"
Reliance Industries to develop state’s first multi-modal logistics park in Chennai - The New Indian Express,"Sat, 12 Nov 2022 08:00:00 GMT"
"Reliance group, Adani bid for India's debt-ridden Future Retail - Reuters","Thu, 10 Nov 2022 08:00:00 GMT"
Reliance Industries Limited - Facebook,"Thu, 24 Nov 2022 08:00:00 GMT"
Reliance Industries to make India’s first multimodal logistics park in Chennai - Adda247,"Tue, 15 Nov 2022 08:00:00 GMT"
India’s Reliance has ruthless Retail ambitions - Financial Times,"Sat, 19 Nov 2022 08:00:00 GMT"
India's Reliance enhances fire-resistant polyester Recron FS - Fibre2Fashion,"Thu, 03 Nov 2022 07:00:00 GMT"
Mukesh Ambani’s RIL Arm To Build Greenfield Smart City Near Gurugram; All You Need To Know - outlookbusiness.com,"Wed, 09 Nov 2022 08:00:00 GMT"
Reliance appoints K V Kamath as independent director - financialexpress.com,"Sat, 05 Nov 2022 07:00:00 GMT"
Reliance Industries appoints veteran banker KV Kamath as independent director - Moneycontrol,"Fri, 04 Nov 2022 07:00:00 GMT"
Reliance Industries seeks shareholder nod to alter MoA for EPC undertaking - Business Standard,"Wed, 30 Nov 2022 08:00:00 GMT"
Mukesh Ambani Reorients Reliance In An Uncertain World - Business Today,"Wed, 30 Nov 2022 08:00:00 GMT"
"“#Jio 5G network significantly better than airtel shows Ookla #5G test report** — Jio 5G network showed almost 600 Mbps median download speed in Delhi, as per Speedtest results by Ookla Ookla used Speedtest data to compare median 5G download speed - Facebook","Thu, 03 Nov 2022 07:00:00 GMT"
Reliance Retail launches athleisure label Xlerate with Hardik Pandya as brand ambassador - CNBC TV18,"Tue, 01 Nov 2022 07:00:00 GMT"
Reliance Industries Limited - News Verification - India Infoline,"Mon, 07 Nov 2022 08:00:00 GMT"
Metro weighs deal with Reliance Industries Limited - Telegraph India,"Sun, 06 Nov 2022 07:00:00 GMT"
India to become $40-trillion economy in Amrit Kaal: Mukesh Ambani - Fortune India,"Wed, 23 Nov 2022 08:00:00 GMT"
"Kamath on RIL board, to head Jio Financial - Telegraph India","Sat, 05 Nov 2022 07:00:00 GMT"
Reliance to build India's first multimodal logistics park in Chennai - CNBC TV18,"Sat, 12 Nov 2022 08:00:00 GMT"
Reliance Jio becomes 1st company to launch 5G in Delhi-NCR - Fortune India,"Fri, 18 Nov 2022 08:00:00 GMT"
"Reliance Industries Set To Acquire METRO Cash & Carry India In Rs 4,060-Crore Deal - ABP Live English","Mon, 07 Nov 2022 08:00:00 GMT"
First Multi-Modal Logistic Park Coming Up At Chennai; Project Awarded To Reliance Industries - Swarajyamag,"Fri, 11 Nov 2022 08:00:00 GMT"
Reliance to buy Metro AG’s India biz for €500 million - Mint,"Sun, 06 Nov 2022 07:00:00 GMT"
Is Reliance Retail Looking Forward To Be the Biggest Player In B2B Segment? - Entrepreneur,"Mon, 07 Nov 2022 08:00:00 GMT"
"Mukesh Ambani to pass on RIL baton to Anant, Dhanraj - The New Indian Express","Wed, 23 Nov 2022 08:00:00 GMT"
Ambani Taps Veteran Banker to Head Financial Services Unit - Bloomberg,"Fri, 04 Nov 2022 07:00:00 GMT"
Reliance unit's smart city near Gurugram attracts four Japanese companies - CNBC TV18,"Wed, 09 Nov 2022 08:00:00 GMT"
Reliance Industries enhances polyester textiles with FRX Nofia technology - CompositesWorld,"Mon, 07 Nov 2022 08:00:00 GMT"
"SBI > Reliance: The King is Dead, Long Live the King! - Equitymaster","Sat, 12 Nov 2022 08:00:00 GMT"
Mukesh Ambani’s Reliance to develop India’s first multimodal logistics park in Chennai​ - PGurus,"Sat, 12 Nov 2022 08:00:00 GMT"
Indian Economy To Grow Thirteen-Fold To $40 Trillion By 2047: RIL Chairman Mukesh Ambani - Swarajyamag,"Wed, 23 Nov 2022 08:00:00 GMT"
K V Kamath becomes an independent director for Reliance Industries - Startup Story,"Mon, 07 Nov 2022 08:00:00 GMT"
Mukesh Ambani's Reliance Set To Acquire Metro AG's Cash & Carry India Biz - India.Com,"Mon, 07 Nov 2022 08:00:00 GMT"
"Media Release: Kieron Pollard announces retirement from playing IPL, appointed as Batting Coach for Mumbai Indians Mumbai Indians - Facebook","Tue, 15 Nov 2022 08:00:00 GMT"
Reliance Jio takes a bold call on financial services amid tough competition - Business Standard,"Tue, 08 Nov 2022 08:00:00 GMT"
"Reliance-backed Jio Platforms launches TikTok alternative in India in partnership with Rolling Stone, Creativeland Asia - Music Business Worldwide","Wed, 30 Nov 2022 08:00:00 GMT"
KV Kamath joins RIL board - The Indian Express,"Fri, 04 Nov 2022 07:00:00 GMT"
"K V Kamath is independent director of RIL, non-exec head of financial arm - Business Standard","Fri, 04 Nov 2022 07:00:00 GMT"
"Reliance to step into salon business, plans to buy 49% stake in Naturals - India Today","Fri, 04 Nov 2022 07:00:00 GMT"
Reliance Strategic Investments appoints K V Kamath as Independent Director - Business Standard,"Fri, 04 Nov 2022 07:00:00 GMT"
KV Kamath Appointed Chairman Of Jio Financial Services - NDTV Profit,"Fri, 04 Nov 2022 07:00:00 GMT"
Reliance gets green approval for World's largest submarine cable - The Economic Times,"Wed, 23 Nov 2022 08:00:00 GMT"
Mukesh Ambani’s Reliance to enter salon business: Report - Mint,"Fri, 04 Nov 2022 07:00:00 GMT"
RIL to develop India’s first multi-modal logistics park near Chennai - BusinessLine,"Fri, 11 Nov 2022 08:00:00 GMT"
MET City: Smart city coming up near Gurugram; all you need to know - The Economic Times,"Tue, 08 Nov 2022 08:00:00 GMT"
Reliance to develop multi-modal logistics park in Tamil Nadu - The Economic Times,"Fri, 11 Nov 2022 08:00:00 GMT"
"From 'Guru' to Isha Ambani's babies, the twin connection in India's second richest family - The Economic Times","Wed, 23 Nov 2022 08:00:00 GMT"
"The BT Billionaires: Gautam Adani, Mukesh Ambani and more - Business Today","Tue, 29 Nov 2022 08:00:00 GMT"
Reliance Retail plans to enter into salon business; acquire stake in Naturals - ET BrandEquity,"Fri, 04 Nov 2022 07:00:00 GMT"
[Throwback] This industrialist fought Dhirubhai Ambani and Kumar Birla to thwart hostile takeover bids; never - Times Now,"Sun, 20 Nov 2022 08:00:00 GMT"
​Mukesh Ambani’s Reliance to develop India's first multimodal logistics park in Chennai​ - Times Now,"Sat, 12 Nov 2022 08:00:00 GMT"
"Reliance to foray into salon business, in talks with Naturals chain - dtnext","Fri, 04 Nov 2022 07:00:00 GMT"
REC Group launches new TOPCon solar module for US rooftop market - PV Tech,"Wed, 09 Nov 2022 08:00:00 GMT"
Reliance Industries Deny Mukesh Ambani Interest in Buying Liverpool FC - The Liverpool Offside,"Mon, 14 Nov 2022 08:00:00 GMT"
"Reliance Beats Amazon, Swiggy & Udaan To Acquire Metro Cash & Carry For INR 4,500 Cr - Inc42","Mon, 07 Nov 2022 08:00:00 GMT"
Reliance's Mukesh Ambani wants to buy Liverpool Football Club - Quartz,"Mon, 14 Nov 2022 08:00:00 GMT"
"Adani, TCG gear up for petrochemical foray as RIL eyes expansion in sector - Business Standard","Sun, 27 Nov 2022 08:00:00 GMT"
Reliance Retail rolls out athleisure brand Xlerate on AJIO Business - Business Standard,"Tue, 01 Nov 2022 07:00:00 GMT"
RIL bags project to develop Mappedu MMLP in Tamil Nadu - Construction World,"Mon, 14 Nov 2022 08:00:00 GMT"
"Nihon Kohden to build its largest manufacturing facility of India at MET City, Haryana - The Statesman","Tue, 08 Nov 2022 08:00:00 GMT"
All the parts of daily life in India controlled by Mukesh Ambani - FlowingData,"Thu, 17 Nov 2022 08:00:00 GMT"
"Adani, Ambani Join The Race To Acquire Big Bazaar's Future Retail: Report - India.Com","Fri, 11 Nov 2022 08:00:00 GMT"
