Headline,Published Date
Securities appellate tribunal quashes Sebi order against Mukesh Ambani - Times of India,"Tue, 05 Dec 2023 08:00:00 GMT"
"SAT quashes Sebi order against Mukesh Ambani, Navi Mumbai SEZ; no relief for RIL - Mint","Mon, 04 Dec 2023 08:00:00 GMT"
Reliance hikes investment in Mercury Holdings to Rs 418 crore - Industry News - financialexpress.com,"Wed, 13 Dec 2023 08:00:00 GMT"
Reliance Industries tops India’s most visible corporate in media ranking - The Statesman,"Wed, 20 Dec 2023 08:00:00 GMT"
"Significant rise in gap between standalone, consolidated net profit of RIL - Business Standard","Mon, 25 Dec 2023 08:00:00 GMT"
Reliance Industries and Walt Disney sign non-binding term sheet to merge Indian media operations: Report - CNBC TV18,"Tue, 26 Dec 2023 08:00:00 GMT"
Ambani aims for AI revamp of Reliance Industries in 2024 - Times of India,"Fri, 29 Dec 2023 08:00:00 GMT"
Reliance Family Day: Mukesh Ambani vows to list RIL among top 10 global conglomerates - Fortune India,"Thu, 28 Dec 2023 08:00:00 GMT"
Big Firms Pass ESG Test... - Fortune India,"Wed, 06 Dec 2023 08:00:00 GMT"
Complete AI transformation across RIL in 2024: Mukesh Ambani to employees - Fortune India,"Sat, 30 Dec 2023 08:00:00 GMT"
India shows some reliance on Venezuelan oil after 3-year hiatus as US sanctions ease - ET EnergyWorld,"Fri, 01 Dec 2023 08:00:00 GMT"
"Mukesh Ambani bats for young RIL, to keep average age of talent at 30s - Business Standard","Thu, 28 Dec 2023 08:00:00 GMT"
Reliance Industries eyes sugar mills for green biogas push - Manufacturing Today India,"Thu, 07 Dec 2023 08:00:00 GMT"
Mukesh Ambani says RIL will grow to be among the top 10 business conglomerates of the world - CNBC TV18,"Thu, 28 Dec 2023 08:00:00 GMT"
Dhirubhai Ambani Birth Anniversary: 5 Interesting Facts About Reliance Industries' Founder - Goodreturns,"Thu, 28 Dec 2023 08:00:00 GMT"
"RIL share price target 2024: Where is the most-valued stock on BSE, NSE headed? - Business Today","Wed, 27 Dec 2023 08:00:00 GMT"
"Disney, Reliance plan London meeting for India media merger talks-sources - Reuters","Wed, 13 Dec 2023 08:00:00 GMT"
RIL and DBS Bank India collaborate to promote CBG project - Indian Chemical News,"Sun, 17 Dec 2023 17:56:18 GMT"
Reliance Industries Ltd aims to be in Top-10 business conglomerates of the world - Telegraph India,"Fri, 29 Dec 2023 08:00:00 GMT"
"Mukesh Ambani pays tribute to father Dhirubhai on Reliance Family Day, underlines vision for future - Mint","Thu, 28 Dec 2023 08:00:00 GMT"
Reliance Industries and DBS Bank India Partner to Promote Compressed Biogas - SMEStreet,"Thu, 14 Dec 2023 08:00:00 GMT"
Reliance Industries in discussions with sugar mills for CBG projects - ChiniMandi,"Thu, 07 Dec 2023 08:00:00 GMT"
Reliance Industries and DBS Bank India Join Forces for CBG Expansion - Energetica India Magazine,"Fri, 15 Dec 2023 08:00:00 GMT"
RIL biggest wealth creator from 2018 to 2023: Study - The Economic Times,"Sun, 17 Dec 2023 08:00:00 GMT"
"Jio, IIT-B collaborate on 'Bharat GPT', Akash Ambani announces TV OS launch - Business Standard","Wed, 27 Dec 2023 08:00:00 GMT"
Reliance Industries emerges as largest wealth creator in 5 years: Motilal Oswal report - Moneycontrol,"Thu, 14 Dec 2023 08:00:00 GMT"
Why is Mukesh Ambani scouring sugar mills across India? - The Economic Times,"Fri, 08 Dec 2023 08:00:00 GMT"
Moody's affirms RIL's Baa2 ratings; outlook stable - ET EnergyWorld,"Thu, 14 Dec 2023 08:00:00 GMT"
Reliance in talks with sugar mill operators for biomass plant plans: Report - Hindustan Times,"Thu, 07 Dec 2023 08:00:00 GMT"
"PDEU at forefront of education, research in energy technologies: Mukesh Ambani at institute's 11th convocation - India TV News","Sat, 02 Dec 2023 08:00:00 GMT"
"Reliance Industries May Absorb Star India as Part of Merger With Disney, Here’s What You Need to Know - IGN India","Tue, 26 Dec 2023 08:00:00 GMT"
"Reliance to invest Rs 75,000 core in powering India’s future sustainability - Manufacturing Today India","Tue, 19 Dec 2023 08:00:00 GMT"
"Disney, Reliance plan London meeting for India media merger talks: Reuters - CNBC TV18","Wed, 13 Dec 2023 08:00:00 GMT"
"Reliance biggest wealth creator, Adani Enterprises top all-round wealthcreator: Motilal Oswal study - BusinessLine","Sun, 17 Dec 2023 08:00:00 GMT"
"Bharat Petroleum may join Reliance, IOCL to secure oil from Venezuela - The Economic Times","Wed, 13 Dec 2023 08:00:00 GMT"
"Mukesh Ambani's Reliance, Disney working to finalize India media operations merger: Report - Indian Startup News","Wed, 13 Dec 2023 08:00:00 GMT"
Dunzo’s survival hinges on Reliance Retail commitment to funds - The Economic Times,"Mon, 11 Dec 2023 08:00:00 GMT"
Honeywell Boosts Safety and Efficiency for Reliance Life Sciences - financialexpress.com,"Tue, 19 Dec 2023 08:00:00 GMT"
"2023 for Conglomerates: Next gen in decision making roles and thrust on new businesses, listings - CNBC TV18","Fri, 22 Dec 2023 08:00:00 GMT"
Dhirubhai Ambani Birth Anniversary 2023: 5 unknown facts about business tycoon - Mint,"Thu, 28 Dec 2023 08:00:00 GMT"
Reliance Jio working with IIT-B to launch 'Bharat GPT' - afaqs!,"Thu, 28 Dec 2023 08:00:00 GMT"
Jio Working On 'Bharat GPT' With IIT-B; To Launch OS For Televisions: Akash Ambani - outlookbusiness.com,"Thu, 28 Dec 2023 08:00:00 GMT"
"NCLT Mumbai Approves Resolution Plan For Reliance Communications Infrastructure Ltd., Valued At Rs 455.9... - Live Law","Fri, 22 Dec 2023 08:00:00 GMT"
Mukesh Ambani's Reliance-Disney Star deal explained: 10 points on mega-merger - Hindustan Times,"Mon, 25 Dec 2023 08:00:00 GMT"
RIL turns to sugar mills to fuel green energy plans - The Economic Times,"Thu, 07 Dec 2023 08:00:00 GMT"
SAT quashes Sebi's fine on Jio Financial on F&O manipulation - The New Indian Express,"Wed, 13 Dec 2023 08:00:00 GMT"
"Disney, Reliance sign pre-deal agreement, mega-merger to be done by Feb - Business Standard","Mon, 25 Dec 2023 08:00:00 GMT"
"SAT quashes Sebi's order against Mukesh Ambani, 2 others in RPL case - Business Standard","Mon, 04 Dec 2023 08:00:00 GMT"
Dhirubhai Ambani's entrepreneurial magic: 6 lessons to learn - YourStory.com,"Wed, 27 Dec 2023 08:00:00 GMT"
‘Undue concession’ to Reliance in Maharashtra led to Rs 41.1 cr loss: CAG - Newslaundry,"Wed, 20 Dec 2023 08:00:00 GMT"
Reliance and Disney in advanced talks for mega-merger in Indian media: Report - Business Today,"Tue, 12 Dec 2023 08:00:00 GMT"
Top Companies for CSR and Sustainability in 2023 - The CSR Journal,"Thu, 28 Dec 2023 08:00:00 GMT"
Reliance Family Day: Mukesh Ambani underlines vision for the future - Times of India,"Thu, 28 Dec 2023 08:00:00 GMT"
Reliance targets Mumbai's wealthy with new shopping mall - Nikkei Asia,"Sun, 03 Dec 2023 08:00:00 GMT"
Reliance Teams With DBS Bank For Biogas Initiative - Adda247,"Thu, 14 Dec 2023 08:00:00 GMT"
MPW 2023: How Isha Ambani is ensuring Reliance Retail’s dominance continues - Business Today,"Tue, 12 Dec 2023 08:00:00 GMT"
"Brookfield-Reliance-Digital Realty JV in India complete, renamed Digital Connexion - W.Media","Wed, 13 Dec 2023 08:00:00 GMT"
Reliance Industries Becomes First in India to Use Chemical Recycling for Circular Polymers - Vibes Of India,"Fri, 29 Dec 2023 08:00:00 GMT"
"Sterling and Wilson Renewable raises ₹1,500 crore via QIP - The Hindu","Fri, 15 Dec 2023 08:00:00 GMT"
"Future of Reliance belongs to Akash, Isha, Anant and their generation, says Mukesh Ambani - Moneycontrol","Thu, 28 Dec 2023 08:00:00 GMT"
"RIL, L&T, Tata Motors Among The List Of Top 10 Companies With Highest Debt In India - Business Today","Thu, 28 Dec 2023 08:00:00 GMT"
Reliance-Disney merger may leave regional networks vulnerable - Brand Wagon News - financialexpress.com,"Wed, 13 Dec 2023 08:00:00 GMT"
No takers for rupee payment for oil imports - ET EnergyWorld,"Mon, 25 Dec 2023 08:00:00 GMT"
"Digital Connexion Completes Formation of Indian Data Centre Venture with Brookfield Infrastructure, Reliance Industries and Digital Realty - CRN - India","Wed, 13 Dec 2023 08:00:00 GMT"
"Disney, Reliance sign non-binding agreement for India media operations merger - ET - Reuters","Sun, 24 Dec 2023 08:00:00 GMT"
'Reliance will become one of top 10 business conglomerates in the world': RIL Chairman Mukesh Ambani addresses employees - Key Points - ET Now,"Thu, 28 Dec 2023 08:00:00 GMT"
"Educational qualifications of Rs 1663000 crore Reliance Industries' board: Mukesh Ambani, Akash, Isha Ambani, others - DNA India","Fri, 08 Dec 2023 08:00:00 GMT"
India to resume import of oil from Venezuela after 3 years as US sanctions on Caracas ease - The Indian Express,"Fri, 01 Dec 2023 08:00:00 GMT"
Dhirubhai Ambani birth anniversary: A look at inspiring journey and achievements of India’s most successful en - CNBC TV18,"Thu, 28 Dec 2023 08:00:00 GMT"
"RIL Share Price Target 2023: Jefferies Bullish on Mukesh Ambani-led Reliance Industries, Retains 'BUY' Tag - Times Now","Wed, 06 Dec 2023 08:00:00 GMT"
Top wealth creating stocks in India: Reliance tops biggest wealth creator list; Adani Enterprises bags fi - Times of India,"Thu, 14 Dec 2023 08:00:00 GMT"
Reliance Communications Infra to be a Mukesh Ambani firm - Insolvency Tracker,"Wed, 20 Dec 2023 08:00:00 GMT"
Mukesh Ambani’s Significant Educational Qualifications - India.Com,"Thu, 14 Dec 2023 08:00:00 GMT"
"India's focus on reskilling and localisation key to competitive edge in new mobility sector, says Nitin Sheth - Autocar Professional","Fri, 08 Dec 2023 08:00:00 GMT"
"Mukesh Ambani talks on 'data, AI', 'world's Top 10 conglomerates' dream in annual address - Hindustan Times","Thu, 28 Dec 2023 08:00:00 GMT"
Reliance Industries committed to make new investments in Tamil Nadu: Mukesh Ambani - The Hindu,"Sun, 07 Jan 2024 08:00:00 GMT"
Reliance Industries shares fall over 1% after Q3 earnings - BusinessLine,"Sat, 20 Jan 2024 08:00:00 GMT"
Big becomes bigger! Reliance Industries market value crosses Rs 18 lakh crore - The Economic Times,"Thu, 11 Jan 2024 08:00:00 GMT"
"Reliance Industries shares rally 3%, hit 52-week high; here’s why - Mint","Wed, 10 Jan 2024 08:00:00 GMT"
"Reliance Industries Q3 results: Profit rises 9.3% to Rs 17,265 crore - Business Standard","Fri, 19 Jan 2024 08:00:00 GMT"
"RIL Q3 results: Net profit rises 11% to Rs 19,641 cr; margin expands 210 bps - Business Today","Fri, 19 Jan 2024 08:00:00 GMT"
Reliance Industries Q3 results LIVE updates: Mukesh Ambani-led company's profit up by 9.3% - Hindustan Times,"Fri, 19 Jan 2024 08:00:00 GMT"
Reliance Industries Shares Hit Record High As Crude Surges - NDTV Profit,"Mon, 29 Jan 2024 08:00:00 GMT"
Reliance Industries gains most since September 2020 to a record high; Market Cap at ₹19.5 lakh crore - CNBC TV18,"Mon, 29 Jan 2024 08:00:00 GMT"
"Reliance Q3 results: Net profit up 11% to ₹19,641 crore; EBITDA up 17% led by oil and gas, retail segments - Mint","Fri, 19 Jan 2024 08:00:00 GMT"
"Reliance Industries to invest in renewable energy, green hydrogen in Tamil Nadu: Mukesh Ambani - The Economic Times","Sun, 07 Jan 2024 08:00:00 GMT"
Earnings from O2C division may remain volatile for Reliance Industries - Business Standard,"Sun, 21 Jan 2024 08:00:00 GMT"
Reliance Industries remains on analysts’ radar as retail momentum persists - BusinessLine,"Sat, 20 Jan 2024 08:00:00 GMT"
"Reliance Industries to see valuation re-rating led by New Energy business, says Nuvama Equities; raises target price - Mint","Thu, 18 Jan 2024 08:00:00 GMT"
Reliance Industries Q3 Results Live Updates: PAT at Rs 17265 cr vs ET NOW poll of Rs 16944 cr - The Economic Times,"Fri, 19 Jan 2024 08:00:00 GMT"
Reliance Industries-Analysts maintain bullish 2024 outlook led by Retail and Jio . Jefferies sees more than 20% upside - Mint,"Fri, 05 Jan 2024 08:00:00 GMT"
"Alok Industries shares surge 20% after RIL invests Rs 3,300 crore - The Economic Times","Tue, 02 Jan 2024 08:00:00 GMT"
Reliance Industries to commission green energy giga complex in Jamnagar in H2 of 2024 - Mint,"Sun, 21 Jan 2024 08:00:00 GMT"
Multibagger penny stock: Reliance funding fuels rally in Alok Industries shares by 65% in five straight sessions - Mint,"Mon, 08 Jan 2024 08:00:00 GMT"
"Reliance Q3 Results Highlights: Net profit up 11% to ₹19,641 crore; O2C revenue down, retail, telecom arms thrive | Company Business News - Mint","Fri, 19 Jan 2024 08:00:00 GMT"
Reliance Industries most valuable Indian company: Hurun Global 500 2023 - Business Standard,"Wed, 31 Jan 2024 08:00:00 GMT"
"TN GIM 2024: Reliance Industries to invest in renewable energy, green hydrogen in Tamil Nadu, says Mukesh... - Moneycontrol","Sun, 07 Jan 2024 08:00:00 GMT"
"Alok Industries share price surges 20% after Reliance Industries invests ₹3,300 crore - Mint","Tue, 02 Jan 2024 08:00:00 GMT"
Reliance Industries first in India to receive ISCC-Plus certification - Sustainable Plastics,"Tue, 02 Jan 2024 08:00:00 GMT"
Reliance Industries’ market capitalisation crosses ₹19.5 lakh crore: How does it stack up against major global firms? - Mint,"Mon, 29 Jan 2024 08:00:00 GMT"
Reliance Industries Ltd rides PLI schemes to close in on $1-1.5/kg Green H2 target - The Economic Times,"Mon, 22 Jan 2024 08:00:00 GMT"
"Reliance share price hits record high, market cap crosses ₹19 lakh crore - Mint","Mon, 29 Jan 2024 08:00:00 GMT"
Alok Industries shares zoom 51% in four days post RIL investment - The Economic Times,"Fri, 05 Jan 2024 08:00:00 GMT"
"Reliance Q3 Results Highlights: Jio, Retail shine; O2C revenue declines; 5 key highlights from RIL Q3 earnings - Mint","Fri, 19 Jan 2024 08:00:00 GMT"
Reliance share price at record high: What exactly is happening and why - Hindustan Times,"Mon, 29 Jan 2024 08:00:00 GMT"
Reliance Industries Limited - Facebook,"Thu, 25 Jan 2024 08:00:00 GMT"
Reliance to commission new energy giga complex this year - The Economic Times,"Sun, 21 Jan 2024 08:00:00 GMT"
"Reliance Industries Q3 Preview: Profit, Revenue Seen Rising, Operating Numbers Could Fall - NDTV Profit","Thu, 18 Jan 2024 08:00:00 GMT"
KKR may invest up to $300 million in Reliance Industries-backed BookMyShow: Report - Times of India,"Wed, 17 Jan 2024 08:00:00 GMT"
India’s Reliance Industries to invest $10bn in green hydrogen project - Bioenergy Insight,"Mon, 08 Jan 2024 08:00:00 GMT"
Mukesh Ambani’s Reliance Industries set for record as Red Sea crisis proves a boon - ET EnergyWorld,"Mon, 29 Jan 2024 08:00:00 GMT"
New year wishlist for Mukesh Ambani from 37 lakh shareholders of Reliance Industries - The Economic Times,"Mon, 08 Jan 2024 08:00:00 GMT"
Reliance sells REC Solar Norway for $22 million - ET EnergyWorld,"Tue, 16 Jan 2024 08:00:00 GMT"
"Reliance Industries, Disney start antitrust diligence on media merger: Report - Business Today","Thu, 04 Jan 2024 08:00:00 GMT"
Reliance Industries-Disney Star merger: Is a bumpy road ahead for beleaguered Zee? - Business Today,"Tue, 23 Jan 2024 08:00:00 GMT"
"Reliance Industries Q3 results: Profit up 9% to ₹17,625 cr in Dec quarter - Fortune India","Fri, 19 Jan 2024 08:00:00 GMT"
Reliance to sell REC’s polysilicon manufacturing arm for $22 million - pv magazine India,"Tue, 16 Jan 2024 08:00:00 GMT"
Reliance Industries Q3 Review: Outlook Positive Despite Stress In O2C Segment - NDTV Profit,"Sat, 20 Jan 2024 08:00:00 GMT"
"Reliance was, is and will remain a Gujarati company: Mukesh Ambani - Times of India","Thu, 11 Jan 2024 08:00:00 GMT"
Reliance Industries Achieves India’s First ISCC-Plus Certification - Adda247,"Thu, 04 Jan 2024 08:00:00 GMT"
Reliance launches entry-level recruitment drive for engineer graduates across business verticals. Here’s how to apply - Mint,"Fri, 12 Jan 2024 08:00:00 GMT"
Reliance Industries' marks Ram Mandir celebration with special initiatives - The Economic Times,"Mon, 22 Jan 2024 08:00:00 GMT"
RIL spends $1.5 bn in acquisitions for its new energy business - BusinessLine,"Mon, 22 Jan 2024 08:00:00 GMT"
Reliance Industries announces holiday for all its offices on January 22 - CNBC TV18,"Fri, 19 Jan 2024 08:00:00 GMT"
"Reliance net profit rises 9%, planned shutdown at oil refinery subdues earnings - ET EnergyWorld","Sat, 20 Jan 2024 08:00:00 GMT"
"RIL Unit, Greenko JV among 8 chosen for electrolyser incentive scheme - The Economic Times","Thu, 11 Jan 2024 08:00:00 GMT"
Reliance-Brookfield to open data centre next week: What makes entry into Adani's turf important and more - Times of India,"Mon, 08 Jan 2024 08:00:00 GMT"
Reliance Industries Limited - Facebook,"Fri, 26 Jan 2024 08:00:00 GMT"
Reliance Industries Unveils Giga Energy Complex Set for Revolutionary Launch in Green Technology Production - SolarQuarter,"Mon, 22 Jan 2024 08:00:00 GMT"
Reliance ‘Jio Brain’: How new AI-powered platform may impact your phone’s connectivity - Business Today,"Wed, 31 Jan 2024 08:00:00 GMT"
"Reliance Jio Q3 results: Net profit rises 12% to Rs 5,208 cr; ARPU rises 2% to Rs 181.7 - Business Today","Fri, 19 Jan 2024 08:00:00 GMT"
Reliance Industries shares rally; Mukesh Ambani enters $100 billion club - Business Today,"Fri, 12 Jan 2024 08:00:00 GMT"
Brookfield-Reliance JV opens data centre in Chennai - financialexpress.com,"Sat, 13 Jan 2024 08:00:00 GMT"
Gujarat to see major boost in green energy with Reliance's multi-billion dollar investment - ET EnergyWorld,"Wed, 10 Jan 2024 08:00:00 GMT"
Reliance To Commission New Energy Giga Complex This Year - outlookbusiness.com,"Mon, 22 Jan 2024 08:00:00 GMT"
Reliance Industries announces holiday for all its offices on January 22 - Mint,"Fri, 19 Jan 2024 08:00:00 GMT"
"Small cap stock hits 20% upper circuit after Reliance Industries invested ₹ 3,300 Cr in the company - Trade Brains","Tue, 02 Jan 2024 08:00:00 GMT"
"RIL, int'l partners launch data centre in Chennai, their first in India - Business Standard","Fri, 12 Jan 2024 08:00:00 GMT"
Can RIL’s capex story take some more twists and turns? | Stock Market News - Mint,"Sun, 21 Jan 2024 08:00:00 GMT"
"Ambani, Adani commit huge investments at Vibrant Gujarat Summit - The Hindu","Wed, 10 Jan 2024 08:00:00 GMT"
"Reliance Industries, HUL, UltraTech Cement Q3 Results Today — Earnings Estimates - NDTV Profit","Fri, 19 Jan 2024 08:00:00 GMT"
Disney and Reliance ‘enter agreement’ to combine Hotstar and Viacom18 in India - SportsPro,"Tue, 02 Jan 2024 08:00:00 GMT"
"Disney and Mukesh Ambani’s Reliance Industries Edge Closer to Massive India TV Deal, Say Reports - Variety","Thu, 04 Jan 2024 08:00:00 GMT"
Reliance to set up carbon fibre facility in Gujarat - BusinessLine,"Wed, 10 Jan 2024 08:00:00 GMT"
"Reliance Industries Shares Decline After Q3 Profit Falls, Misses Estimates - NDTV Profit","Sat, 20 Jan 2024 08:00:00 GMT"
Ram Mandir Inauguration: Reliance announces holiday for all its offices on Jan 22 - The Economic Times,"Fri, 19 Jan 2024 08:00:00 GMT"
"Vibrant Gujarat Summit: Mukesh Ambani calls Reliance Gujarati firm, says most successful PM is... - Hindustan Times","Wed, 10 Jan 2024 08:00:00 GMT"
"Jio, Reliance Retail to steal the show in RIL’s report card for Q3? - Moneycontrol","Wed, 17 Jan 2024 08:00:00 GMT"
Nifty 50 records biggest intraday jump in nearly 2 months: RIL contributes 37% to index’s overall rally - Mint,"Mon, 29 Jan 2024 08:00:00 GMT"
"Reliance Industries Q3 Results Review- Retail, Upstream Offsets Subdued O2C Performance: Yes Securities - NDTV Profit","Tue, 23 Jan 2024 08:00:00 GMT"
Ram Mandir opening: Reliance Industries declares holiday for all its offices on Jan 22 - Business Today,"Fri, 19 Jan 2024 08:00:00 GMT"
Reliance Industries to Unveil New Energy Giga Complex in Gujarat by Late 2024 - Energetica India Magazine,"Mon, 22 Jan 2024 08:00:00 GMT"
"Reliance, Jindal among six firms to get incentives for making electrolysers - Business Standard","Mon, 15 Jan 2024 08:00:00 GMT"
Reliance’s life with Metro - financialexpress.com,"Wed, 17 Jan 2024 08:00:00 GMT"
"‘You are like my son’: When Nitin Gadkari rejected Reliance's bid and upset Dhirubhai Ambani, but… - Business Today","Mon, 29 Jan 2024 08:00:00 GMT"
"Vibrant Gujarat Summit 2024: Reliance is, was and will always remain a Gujarati company, says Mukesh Ambani - Business Today","Wed, 10 Jan 2024 08:00:00 GMT"
"Reliance Vs Tata Vs Adani: The Most Valued Conglomerate In India Is Worth Over Rs 28 Lakh Crore, WHO IS IT? - Goodreturns","Mon, 29 Jan 2024 08:00:00 GMT"
Walt Disney's India unit market valuation halves in Reliance merger talks - Business Standard,"Thu, 25 Jan 2024 08:00:00 GMT"
"Reliance, Brookfield set to open data center in Chennai: Ambani - ET CIO","Mon, 08 Jan 2024 08:00:00 GMT"
HSBC ranked first for India offshore loans in 2023 helped by Reliance deals - Business Standard,"Thu, 11 Jan 2024 08:00:00 GMT"
Mukesh Ambani rejoins $100 billion club as Reliance stock surges record 2.6% - Mint,"Fri, 12 Jan 2024 08:00:00 GMT"
"Jindal Power drops out, Reliance and Adani in bidding race to acquire Lanco Amarkantak Power - Hindustan Times","Fri, 26 Jan 2024 08:00:00 GMT"
"Reliance is, was and will always remain a Gujarati company, says Mukesh Ambani - India Today","Wed, 10 Jan 2024 08:00:00 GMT"
"Reliance Retail Q3 profit up 31.8% to Rs 3,165 cr; gross revenue at Rs 83,063 cr - ET Retail","Fri, 19 Jan 2024 08:00:00 GMT"
"Reliance Was, Is and Always Will Be a Gujarati Company: Mukesh Ambani - Entrepreneur","Wed, 10 Jan 2024 08:00:00 GMT"
"Reliance Industries Announces Holiday Across Offices On January 22, Ram Mandir Inauguration Day - India.Com","Sat, 20 Jan 2024 08:00:00 GMT"
"Alok Industries’ Shares Gain Nearly 65% in 5 Sessions Following Rs 3,300 Crore Investment from Reliance - Equitypandit","Mon, 08 Jan 2024 08:00:00 GMT"
"Coca-Cola India and Reliance Retail Team Up for 'Bhool Na Jana, Plastic Bottle Lautana' PET Collection and Recycling Initiative - PR Newswire","Tue, 16 Jan 2024 08:00:00 GMT"
"Reliance Jio Q3 results: Net profit jumps 12% to ₹5,208 crore - Fortune India","Fri, 19 Jan 2024 08:00:00 GMT"
"Reliance Jio Q3 results: Net profit rises 12.3% to Rs 5,208 crore - Business Standard","Fri, 19 Jan 2024 08:00:00 GMT"
"Reliance Industries celebrates India’s 75th Republic Day with employees, customers - Sarkaritel.com","Fri, 26 Jan 2024 08:00:00 GMT"
Reliance Industries unable to comment on Disney's India division valuation speculation - afaqs!,"Tue, 30 Jan 2024 08:00:00 GMT"
"Alok Industries jumps 20% on RIL’s ₹3,300 cr investment via preferential shares - Fortune India","Tue, 02 Jan 2024 08:00:00 GMT"
3 key messages Mukesh Ambani shared with employees for the New Year on Reliance Family Day - Times of India,"Wed, 03 Jan 2024 08:00:00 GMT"
"Reliance Industries Q3 Results: PAT Rises 9.3% YoY At Rs 17,265 Crore; O2C Segment Hurts Again - Goodreturns","Fri, 19 Jan 2024 08:00:00 GMT"
Reliance Industries sitting on a Rs 90-crore loss in this smallcap stock - The Economic Times,"Fri, 16 Feb 2024 08:00:00 GMT"
Reliance becomes first Indian company to hit Rs 20 lakh crore valuation - Deccan Herald,"Tue, 13 Feb 2024 08:00:00 GMT"
Reliance Industries likely to hit $1 trillion mark in market capitalisation before 2040 - CNBC TV18,"Fri, 16 Feb 2024 08:00:00 GMT"
Reliance Industries: 8 Key reasons why Jefferies has raised earnings estimates and sees more upside for the stock price - Mint,"Tue, 20 Feb 2024 08:00:00 GMT"
"Mukesh Ambani's Reliance Industries is now bigger than Netflix, Accenture; gaining 1 lakh cr annually - Hindustan Times","Fri, 16 Feb 2024 08:00:00 GMT"
Disney to Step Back From India in Mega-Deal with Reliance Industries (Published 2024) - The New York Times,"Wed, 28 Feb 2024 08:00:00 GMT"
Reliance Industries 1st Indian company to reach 20 lakh crore market value - Times of India,"Wed, 14 Feb 2024 08:00:00 GMT"
Upcoming IPOs of Reliance Group - Equitymaster,"Sat, 24 Feb 2024 08:00:00 GMT"
"Reliance makes history, becomes 1st Indian firm to cross Rs 20 lakh market cap - India Today","Tue, 13 Feb 2024 08:00:00 GMT"
F&O Strategy: Buy Reliance Industries Futures - BusinessLine,"Sat, 10 Feb 2024 08:00:00 GMT"
"Reliance Industries to convert its 5,000 ICE trucks to green hydrogen-powered H2ICE trucks by mid-2024 - Autocar Professional","Fri, 02 Feb 2024 08:00:00 GMT"
Disney is hoping an $8.5 billion mega-merger with Reliance will save its India business - Quartz,"Wed, 28 Feb 2024 08:00:00 GMT"
Reliance Industries fights back govt's $5 billion recovery claim - The Economic Times,"Tue, 06 Feb 2024 08:00:00 GMT"
Reliance Industries becomes India's first ₹20 lakh crore company; stock at record high - CNBC TV18,"Tue, 13 Feb 2024 08:00:00 GMT"
RIL to merge Viacom18 with Disney's Star in $8.5bn deal - Times of India,"Thu, 29 Feb 2024 08:00:00 GMT"
Reliance Industries becomes first Indian stock to cross Rs 20 lakh crore market cap - The Economic Times,"Tue, 13 Feb 2024 08:00:00 GMT"
Nita Ambani likely to be chair of India's merged Reliance-Disney media business - ETHRWorld.com,"Wed, 28 Feb 2024 08:00:00 GMT"
"Reliance, Disney sign binding agreement to form JV, to merge media operations in India - The Economic Times","Wed, 28 Feb 2024 08:00:00 GMT"
Reliance and 9 IITs set to unveil BharatGPT Hanooman next month: Here's your guide to the new AI model - The Economic Times,"Sun, 25 Feb 2024 08:00:00 GMT"
Believe it or not! Single-day gain in Nvidia stock more than RIL's total market value - The Economic Times,"Fri, 23 Feb 2024 08:00:00 GMT"
"Reliance Industries to establish 50 compressed biogas plants, Rs 5,000 Crore allocated - Manufacturing Today India","Mon, 26 Feb 2024 08:00:00 GMT"
"The Hydrogen Stream: Reliance Industries to convert existing 5,000 ICE trucks to run on green hydrogen by mid-2024 - pv magazine India","Mon, 05 Feb 2024 08:00:00 GMT"
RIL Tata JV: Mukesh Ambani’s Reliance mulls buying 29% stake in Tata Play from Walt Disney - Mint,"Thu, 15 Feb 2024 08:00:00 GMT"
"Reliance, Disney to merge India media assets to create $8.5 billion powerhouse - Reuters","Wed, 28 Feb 2024 08:00:00 GMT"
Reliance Industries and Tata Group may reportedly enter into first-ever partnership with this deal - Times of India,"Sat, 17 Feb 2024 08:00:00 GMT"
