Headline,Published Date
"Reliance Retail extends deadline to complete Rs 24,713 cr deal with Future - Business Standard","Fri, 02 Apr 2021 07:00:00 GMT"
India's richest man Ambani fined for irregularities in Reliance share issue - Reuters,"Wed, 07 Apr 2021 07:00:00 GMT"
Ambani’s Reliance Buys Iconic Stoke Park for $79 Million - NDTV Profit,"Fri, 23 Apr 2021 07:00:00 GMT"
Mukesh Ambani buys Britain's iconic country club Stoke Park for 57 million pounds - The Economic Times,"Fri, 23 Apr 2021 07:00:00 GMT"
What is Rights Entitlement of shares? How investors can benefit or lose money; all you need to know - financialexpress.com,"Sat, 10 Apr 2021 07:00:00 GMT"
"Reliance, BP start production from second deep-water gas field in KG-D6 block - financialexpress.com","Mon, 26 Apr 2021 07:00:00 GMT"
Reliance Entertainment group CEO Shibasish Sarkar to step down - Mint,"Thu, 08 Apr 2021 07:00:00 GMT"
"Reliance's plan to consolidate media, distribution businesses under N18 fail to fructify - Exchange4media","Thu, 22 Apr 2021 07:00:00 GMT"
"Adani  joins  Reliance, Tata groups  with over $100  billion  market  cap - Mint","Tue, 06 Apr 2021 07:00:00 GMT"
Mukesh Ambani buys Britain's iconic country club Stoke Park for around Rs 592 crore - Times of India,"Fri, 23 Apr 2021 07:00:00 GMT"
Sebi slaps Rs 25 crore fine on Ambanis in 2000 case over alleged violation of the takeover code regulations - The Indian Express,"Wed, 07 Apr 2021 07:00:00 GMT"
Reliance to sell 11.61% stake in Hathway to comply with minimum public shareholding norm - Exchange4media,"Sat, 24 Apr 2021 07:00:00 GMT"
"Mukesh Ambani sends aid to Maharashtra to help fight Covid-19, supplies oxygen from his refineries for free - OpIndia","Thu, 15 Apr 2021 07:00:00 GMT"
"Nita Ambani-backed Reliance Foundation to set up 1,000-bed facility in Jamnagar, provide free Covid treatm - The Economic Times","Thu, 29 Apr 2021 07:00:00 GMT"
Mukesh Ambani Sends Oxygen From His Refineries For Covid Fight - NDTV,"Thu, 15 Apr 2021 07:00:00 GMT"
"Oxygen diverted for Covid fight, work at industries come to a grinding halt - The Indian Express","Sat, 17 Apr 2021 07:00:00 GMT"
"Reliance, bp start 2nd new deepwater gas field in KG D6 block - Telangana Today","Mon, 26 Apr 2021 07:00:00 GMT"
"COVID-19: Reliance Foundation to set up 1,000-bed hospital in Gujarat's Jamnagar - Firstpost","Thu, 29 Apr 2021 07:00:00 GMT"
Reliance Industries buys Britain’s iconic country club Stoke Park for 57 mn pounds - thehitavada.com,"Sat, 24 Apr 2021 07:00:00 GMT"
"ONGC, Reliance KG Basin blocks to drive India’s natural gas output up by 52% by 2024: Report - PSU Watch","Thu, 22 Apr 2021 07:00:00 GMT"
Adani Group third Indian conglomerate to cross $100 billion in m-cap - Business Today,"Tue, 06 Apr 2021 07:00:00 GMT"
Mukesh Ambani is India’s richest billionaire with net worth of $84.5 billion: Forbes - The News Minute,"Wed, 07 Apr 2021 07:00:00 GMT"
RIL to pare stake in Hathway Cable; to launch Rs 442-crore OFS on April 26 - Business Standard,"Sat, 24 Apr 2021 07:00:00 GMT"
Bharti Airtel sells 800 MHz spectrum in three circles to Reliance Jio - Adda247,"Thu, 08 Apr 2021 07:00:00 GMT"
“Serve Copies To Other Side On Caveat”: Supreme Court In Plea Seeking Investigation Into Alleged Corporate Frauds By Reliance Industries Viz. Optical Fibre Infra - LawBeat,"Wed, 21 Apr 2021 07:00:00 GMT"
Reliance fires up flagship deep-water gas field offshore India - Upstream Online,"Sun, 25 Apr 2021 07:00:00 GMT"
"Merger of TV18 Broadcast, Hathway, Den Networks into Network18 called off - Business Standard","Wed, 21 Apr 2021 07:00:00 GMT"
How Indian billionaire Mukesh Ambani plans to revive British toy store chain Hamley’s - South China Morning Post,"Tue, 13 Apr 2021 07:00:00 GMT"
In Contention: Reliance Retail Extends Deadline for Future Deal - Indian Retailer,"Fri, 02 Apr 2021 07:00:00 GMT"
Has Jai Anmol restarted the Ambani family feud? - South China Morning Post,"Thu, 15 Apr 2021 07:00:00 GMT"
Inside Mukesh Ambani’s US$79 million James Bond mansion - South China Morning Post,"Mon, 26 Apr 2021 07:00:00 GMT"
Ambanis in crisis: is 2021 Mukesh and Nita’s worst year yet? - South China Morning Post,"Sat, 17 Apr 2021 07:00:00 GMT"
Reliance slams Congress leader for misinformation on oxygen supply - OpIndia,"Wed, 21 Apr 2021 07:00:00 GMT"
Amazon Vs Future Feat. Reliance: Everything You Need To Know Explained In 6 Points - Inc42,"Thu, 22 Apr 2021 07:00:00 GMT"
"How Mukesh Ambani is quietly reviving the fortunes of Hamleys, your favourite toy store - ThePrint","Wed, 14 Apr 2021 07:00:00 GMT"
Stoke Park sold for £57m - Golf Business News,"Mon, 26 Apr 2021 07:00:00 GMT"
Asia's richest man rebuilds 261-year-old British icon - The Straits Times,"Tue, 13 Apr 2021 07:00:00 GMT"
"Big Bazaar, Reliance Join Forces To Offer Mega Discount Sale; Get 20% Discount On These Purchases! - Trak.in","Thu, 01 Apr 2021 07:00:00 GMT"
Heranba Industries trades higher on getting consent to establish for manufacturing of Products at Saykha - udaipurkiran.com,"Tue, 20 Apr 2021 07:00:00 GMT"
Heranba Industries jumps on acquiring Industrial Shed - udaipurkiran.com,"Mon, 26 Apr 2021 07:00:00 GMT"
Reliance takes steps to expand its pharma biz - Mint,"Tue, 04 May 2021 07:00:00 GMT"
"Infibeam says it has signed definitive agreement with Reliance Industries’ Jio Platforms, have applied for - The Economic Times","Thu, 27 May 2021 07:00:00 GMT"
"Reliance Industries' profit more than doubles to Rs 13,227 crore in Q4 - Business Standard","Sat, 01 May 2021 07:00:00 GMT"
Reliance Industries Limited rallies its resources on a war footing to become Nation’s largest producer of medical-grade liquid oxygen from a single location • Produces over 11% of India’s total production of medical grade liquid oxygen - serving the needs of ne - Facebook,"Sat, 01 May 2021 07:00:00 GMT"
Pandemic poses hurdles for Reliance Retail - Fortune India,"Wed, 05 May 2021 07:00:00 GMT"
"9. Thanks to Reliance Industries, India 3rd largest plastic waste producer - Times of India","Wed, 19 May 2021 07:00:00 GMT"
Reliance Industries is paying out bonuses to 2 lakh employees - HR Katha,"Tue, 04 May 2021 07:00:00 GMT"
Reliance Industries’ earnings disappoint markets – stocks fall by over 2% in morning trade - Business Insider,"Sun, 02 May 2021 07:00:00 GMT"
COVID-19: Reliance becomes India's largest medical oxygen producer - Business Today,"Sat, 01 May 2021 07:00:00 GMT"
"Dr Anurag Pandey: Lead, Hydrogen Economy, R&D, Reliance Industries Limited - Renewable Watch Magazine","Tue, 04 May 2021 07:00:00 GMT"
India ranks 94 in per capita single-use plastic waste production: Report - India Today,"Wed, 19 May 2021 07:00:00 GMT"
"RIL ramps up production of liquid medical oxygen, augments tankers for faster supplies - The Hindu","Sat, 01 May 2021 07:00:00 GMT"
Reliance Industries’ deleveraging set to continue: S&P - ThePrint,"Thu, 06 May 2021 07:00:00 GMT"
"Reliance Retail names Shathi Sharma as Vice President, Human Resources - Elets CIO","Fri, 21 May 2021 07:00:00 GMT"
"Jio ensures that JioPhone users will remain connected during the Pandemic - #JioPhone users to get 300 minutes of outgoing voice calls per month, Free - Buy-One-Get-One with every JioPhone Plan To ensure this, Jio has announced two special initiatives fo - Facebook","Fri, 14 May 2021 07:00:00 GMT"
Will Adani beat Ambani to become richest Indian? Umm...did you count Jio? - Business Today,"Tue, 25 May 2021 07:00:00 GMT"
Only the shareholders holding the partly paid-up equity shares of Reliance Industries Limited are to pay the First Call of Rs 314.25 per partly paid-up equity share. - Facebook,"Wed, 19 May 2021 07:00:00 GMT"
"Reliance Foundation installs a captive medical grade Oxygen tank for the first phase 400-bed COVID-care facility of the proposed 1000 bedded hospital at Jamnagar. The 400-bedded COVID care facility has been set up at the Government Dental Hospital, whi - Facebook","Wed, 12 May 2021 07:00:00 GMT"
Mukesh Ambani's Reliance Is One Of Biggest Donors In Covid Relief Response; Other Firms Join Too - India.Com,"Mon, 10 May 2021 07:00:00 GMT"
"Mumbai: RIL, nation’s largest oxygen producer from one location - Times of India","Sun, 02 May 2021 07:00:00 GMT"
Reliance Buys The Iconic UK Hotel Stoke Park For $79 Million: Know 5 Fascinating Facts About This Property - curlytales.com,"Thu, 13 May 2021 07:00:00 GMT"
Ambani’s Reliance flags economic pain as Covid 2nd wave devastates India - ThePrint,"Sat, 01 May 2021 07:00:00 GMT"
"India Inc to the rescue! How Tata, RIL, Adani & others are helping fight Covid-19 - Business Today","Wed, 19 May 2021 07:00:00 GMT"
"Tata buys majority stake in BigBasket; to battle Amazon, Flipkart, Reliance in online grocery market - financialexpress.com","Fri, 28 May 2021 07:00:00 GMT"
2 Lakh Reliance Employees Will Get Special Bonus As Company Earns Rs 147 Crore/Day In Last 12 Months - Trak.in,"Wed, 05 May 2021 07:00:00 GMT"
Gautam Adani becomes Asia's second richest person after Mukesh Ambani - Business Standard,"Fri, 21 May 2021 07:00:00 GMT"
Reliance Group among the top donors in India Inc’s COVID relief response: Read the details - OpIndia,"Mon, 10 May 2021 07:00:00 GMT"
"From Zero before pandemic, Reliance Jamnagar now produces over 11% of India's medical grade liquid oxygen for free supply to States - DeshGujarat","Sat, 01 May 2021 07:00:00 GMT"
Reliance Retail World’s 2nd Fastest Growing Retail Brand; Only Indian Firm In Top 250 List - Trak.in,"Mon, 10 May 2021 07:00:00 GMT"
Fact-check: Did Reliance pass off liquid oxygen imported from Saudi Arabia as its own? - Alt News,"Wed, 12 May 2021 07:00:00 GMT"
Gautam Adani closes in on net worth of Asia's richest man Mukesh Ambani - India Today,"Fri, 21 May 2021 07:00:00 GMT"
"Reliance Is India's Largest Producer Of Liquid Oxygen: Over 1,000 MT Per Day - Indiatimes","Tue, 04 May 2021 07:00:00 GMT"
"Markets Live Today: Highlights! Closing bell! THESE STOCKS gain as BSE Sensex, NSE Nifty 50 end on a positive note on expiry day - Zee Business","Mon, 31 May 2021 07:00:00 GMT"
4 untold stories from Mukesh Ambani’s childhood - South China Morning Post,"Wed, 26 May 2021 07:00:00 GMT"
"Tata acquires majority stake in BigBasket, invests $219 million - Mint","Fri, 28 May 2021 07:00:00 GMT"
How Global & Domestic Industries Lent a Helping Hand - Siliconindia,"Mon, 10 May 2021 07:00:00 GMT"
Inspiring Minds. Connecting People….Digitally! - The Sunday Guardian Live,"Sat, 29 May 2021 07:00:00 GMT"
Is the Ambani family facing its biggest PR crisis yet? - South China Morning Post,"Tue, 18 May 2021 07:00:00 GMT"
Visuals Of Oxygen Tanker With Reliance Stickers Viral With False Claim | BOOM - BOOM Fact Check,"Sat, 08 May 2021 07:00:00 GMT"
Rajiv Gupta joins Tricolite as the CEO. - BW People,"Tue, 25 May 2021 07:00:00 GMT"
Rajiv Gupta quits Honda Cars; joins Tricolite as CEO - ET Auto,"Mon, 24 May 2021 07:00:00 GMT"
India’s leading venture capitalist Vani Kola on how to make it against the odds - Vogue India,"Thu, 27 May 2021 07:00:00 GMT"
Retired Vice President in RIL becomes Jain monk - DeshGujarat,"Sun, 02 May 2021 07:00:00 GMT"
Investigating the U.S. Reliance on Foreign Suppliers - Federal Reserve Bank of St. Louis,"Thu, 13 May 2021 07:00:00 GMT"
"Billionaire Mukesh Ambani Pays $79 Million For British Golf Resort Made Famous By The Movie ""Goldfinger"" - Celebrity Net Worth","Fri, 07 May 2021 07:00:00 GMT"
Reliance Industries on a hiring spree for new clean energy business - The Economic Times,"Wed, 30 Jun 2021 07:00:00 GMT"
Reliance Industries to face stiff competition in clean energy sphere - CNBC TV18,"Fri, 25 Jun 2021 07:00:00 GMT"
Indian refining giant Reliance unveils $10-bln green energy plan - Reuters,"Thu, 24 Jun 2021 07:00:00 GMT"
A strong balance sheet and RIL’s growth plans - Fortune India,"Fri, 04 Jun 2021 07:00:00 GMT"
Reliance Industries to give 5 years of salary to families of employees who died of Covid - Mint,"Thu, 03 Jun 2021 07:00:00 GMT"
India’s biggest oil refiner to invest $10bn in clean energy ‘gigafactories’ - Climate Home News,"Fri, 25 Jun 2021 07:00:00 GMT"
"Reliance Industries' balance sheet is strong, says Mukesh Ambani - Business Standard","Wed, 02 Jun 2021 07:00:00 GMT"
"RIL AGM: Reliance Industries Plans To Invest Rs 75,000 Crore In New Energy Business - NDTV Profit","Thu, 24 Jun 2021 07:00:00 GMT"
"Automotive impact of Reliance Industries’ Rs 75,000cr investment in renewable energy explained - financialexpress.com","Fri, 25 Jun 2021 07:00:00 GMT"
Reliance Industries Limited - Facebook,"Tue, 01 Jun 2021 07:00:00 GMT"
Consumer Tech Becomes The Cash Cow Of Mukesh Ambani’s Reliance Empire - Inc42,"Thu, 24 Jun 2021 07:00:00 GMT"
Saudi Aramco chairman Yasir Al-Rumayyan to join Reliance Industries board - ET EnergyWorld,"Thu, 24 Jun 2021 07:00:00 GMT"
Reliance Industries expects Saudi Aramco deal to formalise this year - Reuters,"Thu, 24 Jun 2021 07:00:00 GMT"
Retail to be next growth engine for Reliance Industries: Goldman Sachs - CNBC TV18,"Mon, 21 Jun 2021 07:00:00 GMT"
Saudi Aramco chairman Yasir Al-Rumayyan joins Reliance Industries Board - The Economic Times,"Thu, 24 Jun 2021 07:00:00 GMT"
ADNOC and Reliance Industries to set up petrochemical project in Abu Dhabi - Business Standard,"Wed, 30 Jun 2021 07:00:00 GMT"
"#RIL has been recognized as one of ‘India’s Best Employers Among Nation Builders – 2021’ by the Great Place to Work®️ Institute. This recognition reinforces the trust that our people place in the management of our organization, the pride that our people exp - Facebook","Fri, 18 Jun 2021 07:00:00 GMT"
Reliance Ind’s joint CFO buys two sea-facing apartments in Mumbai’s Prabhadevi for Rs 40 cr - The Economic Times,"Mon, 21 Jun 2021 07:00:00 GMT"
Reliance Industries lines up petrochemical play with Adnoc in UAE - The Economic Times,"Tue, 29 Jun 2021 07:00:00 GMT"
"The Reliance Emerging Leaders Program (RELP) batch of 2021 received a grand welcome through interactions with leaders like Sh Srinivasan B and Sh Ashwani Prashara. Through these engaging and informative sessions, the RELs learned more about the - Facebook","Wed, 09 Jun 2021 07:00:00 GMT"
Reliance Industries earns a place in the sun with global solar play - Business Standard,"Sat, 26 Jun 2021 07:00:00 GMT"
"Reliance Industries raised Rs 3.24 lakh cr capital through equity sale, rights issue, asset monetisation: - The Economic Times","Thu, 24 Jun 2021 07:00:00 GMT"
Reliance Industries chairman Mukesh Ambani draws nil salary - Mint,"Thu, 03 Jun 2021 07:00:00 GMT"
"Five years salary, health and education for Reliance’s Covid victims - Capacity Media","Thu, 10 Jun 2021 07:00:00 GMT"
Reliance Industries to build four giga factories in India - ETN News,"Thu, 24 Jun 2021 07:00:00 GMT"
Reliance Industries Limited - Facebook,"Fri, 25 Jun 2021 07:00:00 GMT"
Decoded: Reliance Industries’ shaky zero net debt boast in FY21 report - The New Indian Express,"Sun, 06 Jun 2021 07:00:00 GMT"
"Reliance BP Mobility Limited sets up Mobile Fuel Bowser in Gurugram to provide Free Fuel to COVID Ambulances • Mobile Fuel Bowser to be stationed at Government PG College, Sector 9, Basai Road • Part of pan-India initiative by RBML and Reliance Foun - Facebook","Wed, 02 Jun 2021 07:00:00 GMT"
RIL AGM: Reliance Retail Will Focus On These Key Areas In FY22 - NDTV Profit,"Fri, 25 Jun 2021 07:00:00 GMT"
Edtech is the next frontier for RIL | Company Business News - Mint,"Sun, 13 Jun 2021 07:00:00 GMT"
"RIL AGM: Jio Institute to start academic sessions this year, says Nita Ambani - Mint","Thu, 24 Jun 2021 07:00:00 GMT"
"Reliance to Foray into Solar, Battery Storage, Green Hydrogen, and Fuel Cell Production - Mercomindia.com","Fri, 25 Jun 2021 07:00:00 GMT"
Reliance Industries sees big opportunity in global consensus against climate change - Moneycontrol,"Thu, 03 Jun 2021 07:00:00 GMT"
Reliance shuts unit at Jamnagar refinery - The Hindu,"Thu, 10 Jun 2021 07:00:00 GMT"
"Connectivity, communication are fundamental rights: Mukesh Ambani - Business Standard","Mon, 21 Jun 2021 07:00:00 GMT"
Reliance producing over 11% of India's medical-grade liquid oxygen: Nita Ambani - Business Today,"Thu, 24 Jun 2021 07:00:00 GMT"
Here's how RIL stock fared on AGM days in last 12 years - The Economic Times,"Thu, 24 Jun 2021 07:00:00 GMT"
Why Amazon Is Confronting the Richest Man in India (Published 2021) - The New York Times,"Tue, 15 Jun 2021 07:00:00 GMT"
"Reliance collaborates with Google, Microsoft for 5G and Cloud - W.Media","Mon, 28 Jun 2021 07:00:00 GMT"
Reliance to focus on new materials and green chemicals - Indian Chemical News,"Fri, 25 Jun 2021 07:00:00 GMT"
"Reliance Industries Ltd to invest Rs 75,000-crore in clean energy business in Jamnagar - Times of India","Fri, 25 Jun 2021 07:00:00 GMT"
Reliance Retail got sizable revenue in FY21 from digital commerce - Business Standard,"Thu, 03 Jun 2021 07:00:00 GMT"
Reliance AGM 2021: Here's the full text of Chairman Mukesh Ambani's speech - CNBC TV18,"Thu, 24 Jun 2021 07:00:00 GMT"
"India's Reliance says FCCU unit at Jamnagar refinery shut, exports may be delayed - Reuters","Thu, 10 Jun 2021 07:00:00 GMT"
"Google expands Jio partnership with Indian smartphone, cloud tie-ups - Reuters","Thu, 24 Jun 2021 07:00:00 GMT"
Reliance bets on hydrogen boom; plans a gigafactory - ET Auto,"Fri, 25 Jun 2021 07:00:00 GMT"
Asia’s richest man Mukesh Ambani unveils $10bn green energy push - Al Jazeera,"Thu, 24 Jun 2021 07:00:00 GMT"
"F&O expiry: IT, banks lift Sensex 393 pts up; RIL slips 2.4% post 44th AGM - Business Standard","Thu, 24 Jun 2021 07:00:00 GMT"
"Reliance says FCCU unit at Jamnagar refinery shut, exports may be delayed - Mint","Thu, 10 Jun 2021 07:00:00 GMT"
What's Driving the Rally in Reliance Shares? - Equitymaster,"Tue, 01 Jun 2021 07:00:00 GMT"
"Reliance to invest Rs 75,000 cr in new energy business over 3 years: Ambani - Business Standard","Thu, 24 Jun 2021 07:00:00 GMT"
Is it possible for Reliance’s New Renewable Energy Business to become as successful as Jio? - Trade Brains,"Tue, 29 Jun 2021 07:00:00 GMT"
"If Reliance is serious about renewables, the era of oil is truly ending - Quartz","Thu, 24 Jun 2021 07:00:00 GMT"
Mukesh Ambani says Reliance now has strong balance sheet to support growth - Business Standard,"Wed, 02 Jun 2021 07:00:00 GMT"
Reliance AGM 2021 Highlights: What all happened at Mukesh Ambani's Annual General Meeting - The Economic Times,"Thu, 24 Jun 2021 07:00:00 GMT"
Companies must go green to survive: Mukesh Ambani - Times of India,"Tue, 22 Jun 2021 07:00:00 GMT"
"Jio enters into cloud partnership with Google for 5G, retail and other businesses - ET Telecom","Thu, 24 Jun 2021 07:00:00 GMT"
Mukesh Ambani throws a $10 billion clean energy challenge at rivals - Times of India,"Fri, 25 Jun 2021 07:00:00 GMT"
Why is Mukesh Ambani building an international undersea cable system? - Quartz,"Wed, 02 Jun 2021 07:00:00 GMT"
"Reliance Retail to grow 3x in next 3-5 years, create 10 lakh jobs: RIL Chairman - financialexpress.com","Thu, 24 Jun 2021 07:00:00 GMT"
Reliance Retail set to grow threefold in the next 3-5 years: Mukesh Ambani - Mint,"Thu, 24 Jun 2021 07:00:00 GMT"
Reliance to establish and enable 100 GW solar energy - Indian Chemical News,"Mon, 28 Jun 2021 03:03:52 GMT"
"Reliance AGM 2021: JioMart, Future deal in focus as retail set to drive growth for RIL - Moneycontrol","Thu, 24 Jun 2021 07:00:00 GMT"
Saudi Aramco chairman Yasir Al-Rumayyan joins Reliance board: Mukesh Ambani - Business Standard,"Thu, 24 Jun 2021 07:00:00 GMT"
Reliance AGM 2021: Mukesh Ambani To Take On Adani With Investments Of $10 Bn In New Energy Business - ABP Live English,"Thu, 24 Jun 2021 07:00:00 GMT"
"Reliance Industries Ltd RIL To Invest ₹75,000 Crore In Green Energy Initiative. - Startup Story","Fri, 25 Jun 2021 07:00:00 GMT"
Two American retailers are giving some of India’s largest legacy businesses a run for their money - Quartz,"Wed, 09 Jun 2021 07:00:00 GMT"
Mukesh Ambani announces smartphone in partnership with Google - Jio Phone Next - Business Today,"Thu, 24 Jun 2021 07:00:00 GMT"
RIL 44th AGM: Here's the full text of Mukesh Ambani's speech - The Economic Times,"Thu, 24 Jun 2021 07:00:00 GMT"
India's Reliance and ADNOC join forces in chemical project - Reuters,"Tue, 29 Jun 2021 07:00:00 GMT"
"All Big Announcements During Reliance Industries' 44th Annual General Meeting, In Photos - News18 - News18","Thu, 24 Jun 2021 07:00:00 GMT"
RIL chief Mukesh Ambani draws nil salary - Times of India,"Thu, 03 Jun 2021 07:00:00 GMT"
"Reliance-Google announce world's most affordable 4G smartphone, JioPhone Next - YourStory.com","Thu, 24 Jun 2021 07:00:00 GMT"
"ADNOC, Reliance Industries ink pact for chemical projects at TA’ZIZ in Ruwais - ProjectsMonitor","Wed, 30 Jun 2021 07:00:00 GMT"
Reliance Retail aims three-fold growth in 3-5 years - financialexpress.com,"Fri, 25 Jun 2021 07:00:00 GMT"
What Reliance’s push towards green hydrogen power means for India’s EV ecosystem - Moneycontrol,"Fri, 25 Jun 2021 07:00:00 GMT"
"JioPhone Next smartphone launched, Google says it runs special version of Android - India Today","Thu, 24 Jun 2021 07:00:00 GMT"
"India’s new e-commerce rules cast clouds over Amazon, Flipkart, Reliance JioMart - financialexpress.com","Wed, 23 Jun 2021 07:00:00 GMT"
"Mukesh Ambani's Rs 75,000 cr solar power plan to challenge Adani, Tata - Business Today","Thu, 24 Jun 2021 07:00:00 GMT"
Mukesh Ambani took home no salary in FY21 amid Covid-19 pandemic - Business Today,"Wed, 02 Jun 2021 07:00:00 GMT"
Tata takes on Reliance in online pharmacy battle with 1MG acquisition: 10 points - Mint,"Thu, 10 Jun 2021 07:00:00 GMT"
JioPhone Next by Google launched; to be available from September 10 - ET Telecom,"Thu, 24 Jun 2021 07:00:00 GMT"
"Reliance launches smartphone JioPhone Next, to be available from September 10 - Scroll.in","Thu, 24 Jun 2021 07:00:00 GMT"
Missed Opportunities by Indian Chemical Industry- A Few Case Studies Amongst Many - Chemical Industry Digest,"Tue, 01 Jun 2021 07:00:00 GMT"
"Silicon Valley gave Asia’s richest man billions, but things aren’t all going to plan - CNN","Thu, 24 Jun 2021 07:00:00 GMT"
Is Reliance Jio Signalling A Tariff Hike? - Capitalmind,"Mon, 21 Jun 2021 07:00:00 GMT"
Reliance BP Mobility To Build 24 EV Battery Swap Stations - Saur Energy International,"Sat, 05 Jun 2021 07:00:00 GMT"
Ajio accounts for 25% of Reliance Retail’s apparel biz - Mint,"Fri, 25 Jun 2021 07:00:00 GMT"
Retail Biz Likely to Drive Reliance's Growth in the Coming Future - Indian Retailer,"Tue, 22 Jun 2021 07:00:00 GMT"
Intel to work with India’s Reliance Jio on 5G network technology - Reuters,"Mon, 21 Jun 2021 07:00:00 GMT"
Jio Institute: What do we know so far about Mukesh Ambani’s “Institute of Eminence” - Quartz,"Mon, 28 Jun 2021 07:00:00 GMT"
"Jio, Google Cloud push 5G to boost CX in India - Frontier Enterprise","Fri, 25 Jun 2021 07:00:00 GMT"
Reliance Industries can catalyse investments of over $200 billion: Mukesh Ambani - orissapost.com,"Fri, 25 Jun 2021 07:00:00 GMT"
Editors Take: Anil Singhvi says SGX Nifty justifies its opening today - Market Guru DECODES - Zee Business,"Thu, 03 Jun 2021 07:00:00 GMT"
Tech promoters top list of cash recipients; family-owned groups earn less - Business Standard,"Mon, 21 Jun 2021 07:00:00 GMT"
Reliance Announces Family Support & Welfare Scheme To Help Kin Of Covid Deceased Employees - ABP Live English,"Thu, 03 Jun 2021 07:00:00 GMT"
Saudi Aramco chief Yasir Al-Rumayyan to join Reliance board - ANI News,"Thu, 24 Jun 2021 07:00:00 GMT"
Google Cloud and Indian telco giant Jio reveal 5G collaboration - IT Pro,"Fri, 25 Jun 2021 07:00:00 GMT"
"ADNOC, Reliance sign strategic partnership for world-scale chemical projects at TA'ZIZ in Abu Dhabi's Ruwais - ANI News","Tue, 29 Jun 2021 07:00:00 GMT"
Reliance Jio And Google Announce JioPhone Next Ultra Affordable 4G Phone And 5G Partnership - News18,"Fri, 25 Jun 2021 07:00:00 GMT"
Reliance Industries lags peers in rewarding investors with cash pay-outs - Business Standard,"Tue, 06 Jul 2021 07:00:00 GMT"
Bombay High Court grants relief to Reliance Industries in BKC land development case - The Economic Times,"Mon, 12 Jul 2021 07:00:00 GMT"
Reliance Industries eyes stake in home styling brand Portico - Business Today,"Tue, 06 Jul 2021 07:00:00 GMT"
How the Facebook-Reliance combine and the farm laws pave the way for digital colonisation - The Caravan,"Tue, 13 Jul 2021 07:00:00 GMT"
"Reliance Industries Q1 Results: Net Profit Falls 7% YoY to ₹12,273 Cr - Groww","Mon, 26 Jul 2021 07:00:00 GMT"
Reliance Industries Limited - Facebook,"Fri, 23 Jul 2021 07:00:00 GMT"
Reliance Industries to start gas production from MJ field in Q4 FY22 - Construction World,"Tue, 27 Jul 2021 07:00:00 GMT"
Aramco chairman Yasir Al-Rumayyan joins Reliance Industries board - ETHRWorld.com,"Thu, 22 Jul 2021 07:00:00 GMT"
"Dhirubhai Ambani: From gas station attendant to Founder of Reliance Industries Group; awards, achievements - financialexpress.com","Tue, 06 Jul 2021 07:00:00 GMT"
Reliance New Energy Solar Incorporated as the Wholly-Owned Subsidiary of Reliance Inds - Mercomindia.com,"Wed, 14 Jul 2021 07:00:00 GMT"
Anant Ambani’s growing presence at Reliance Industries - Quartz,"Tue, 06 Jul 2021 07:00:00 GMT"
Reliance In Talks With Singapore's Flex And Karbonn Phone Maker UTL To Make JioPhone Next - Swarajyamag,"Wed, 07 Jul 2021 07:00:00 GMT"
"Reliance Industries is considering purchasing REC, a Norwegian solar module manufacturer - Trade Brains","Thu, 08 Jul 2021 07:00:00 GMT"
Reliance Retail's Acquisition of Just Dial: Explained - marketfeed,"Fri, 23 Jul 2021 07:00:00 GMT"
"Reliance's O2C, new energy business may be valued over $100 billion: Report - The Economic Times","Sun, 18 Jul 2021 07:00:00 GMT"
