Headline,Published Date
Asia's richest man rebuilds 261-year-old British icon - The Straits Times,"Tue, 13 Apr 2021 07:00:00 GMT"
Dhirubhai Ambani- India’s most enterprising entrepreneur - SugerMint,"Sun, 25 Apr 2021 08:20:24 GMT"
List of Companies owned by Mukesh Ambani in 2021 - India Shorts,"Tue, 27 Apr 2021 07:00:00 GMT"
Heranba Industries jumps on acquiring Industrial Shed - udaipurkiran.com,"Mon, 26 Apr 2021 07:00:00 GMT"
Heranba Industries trades higher on getting consent to establish for manufacturing of Products at Saykha - udaipurkiran.com,"Tue, 20 Apr 2021 07:00:00 GMT"
Reliance takes steps to expand its pharma biz - Mint,"Tue, 04 May 2021 07:00:00 GMT"
"Reliance Industries' profit more than doubles to Rs 13,227 crore in Q4 - Business Standard","Sat, 01 May 2021 07:00:00 GMT"
"Infibeam says it has signed definitive agreement with Reliance Industries’ Jio Platforms, have applied for - The Economic Times","Thu, 27 May 2021 07:00:00 GMT"
Billionaire Mukesh Ambani’s Reliance Industries Holds India’s Top Spot On Forbes Global 2000 - Forbes,"Thu, 13 May 2021 07:00:00 GMT"
Only the shareholders holding the partly paid-up equity shares of Reliance Industries Limited are to pay the First Call of Rs 314.25 per partly paid-up equity share. - Facebook,"Wed, 19 May 2021 07:00:00 GMT"
Reliance Industries is paying out bonuses to 2 lakh employees - HR Katha,"Tue, 04 May 2021 07:00:00 GMT"
"Dr Anurag Pandey: Lead, Hydrogen Economy, R&D, Reliance Industries Limited - Renewable Watch Magazine","Tue, 04 May 2021 07:00:00 GMT"
COVID-19: Reliance becomes India's largest medical oxygen producer - Business Today,"Sat, 01 May 2021 07:00:00 GMT"
Reliance Industries’ deleveraging set to continue: S&P - ThePrint,"Thu, 06 May 2021 07:00:00 GMT"
Pandemic poses hurdles for Reliance Retail’ - Fortune India,"Wed, 05 May 2021 07:00:00 GMT"
India ranks 94 in per capita single-use plastic waste production: Report - India Today,"Wed, 19 May 2021 07:00:00 GMT"
"RIL ramps up production of liquid medical oxygen, augments tankers for faster supplies - The Hindu","Sat, 01 May 2021 07:00:00 GMT"
Mukesh Ambani's Reliance Is One Of Biggest Donors In Covid Relief Response; Other Firms Join Too - India.Com,"Mon, 10 May 2021 07:00:00 GMT"
"Reliance Retail names Shathi Sharma as Vice President, Human Resources - Elets CIO","Fri, 21 May 2021 07:00:00 GMT"
Reliance loses retail crown to S Korean ecomm rival - BusinessLine,"Mon, 10 May 2021 07:00:00 GMT"
Jio user additions highlight in RIL Q4; covid-19 challenges ahead - Mint,"Mon, 03 May 2021 07:00:00 GMT"
"Reliance Foundation installs a captive medical grade Oxygen tank for the first phase 400-bed COVID-care facility of the proposed 1000 bedded hospital at Jamnagar. The 400-bedded COVID care facility has been set up at the Government Dental Hospital, whi - Facebook","Wed, 12 May 2021 07:00:00 GMT"
Reliance becomes India's largest producer of medical grade liquid oxygen from single location - The Economic Times,"Sat, 01 May 2021 07:00:00 GMT"
Will Adani beat Ambani to become richest Indian? Umm...did you count Jio? - Business Today,"Tue, 25 May 2021 07:00:00 GMT"
Reliance Jio building largest international submarine cable system centred on India - Mint,"Mon, 17 May 2021 07:00:00 GMT"
Mubadala Keeping Pace With KKR as $29 Billion Deployed Last Year - NDTV Profit,"Thu, 06 May 2021 07:00:00 GMT"
Reliance Buys The Iconic UK Hotel Stoke Park For $79 Million: Know 5 Fascinating Facts About This Property - curlytales.com,"Thu, 13 May 2021 07:00:00 GMT"
Ambani’s Reliance flags economic pain as Covid 2nd wave devastates India - ThePrint,"Sat, 01 May 2021 07:00:00 GMT"
"India Inc to the rescue! How Tata, RIL, Adani & others are helping fight Covid-19 - Business Today","Wed, 19 May 2021 07:00:00 GMT"
India's natural gas output rises 23% as RIL-BP fields start production - Business Standard,"Fri, 21 May 2021 07:00:00 GMT"
2 Lakh Reliance Employees Will Get Special Bonus As Company Earns Rs 147 Crore/Day In Last 12 Months - Trak.in,"Wed, 05 May 2021 07:00:00 GMT"
Gautam Adani becomes Asia's second richest person after Mukesh Ambani - Business Standard,"Fri, 21 May 2021 07:00:00 GMT"
"Tata buys majority stake in BigBasket; to battle Amazon, Flipkart, Reliance in online grocery market - financialexpress.com","Fri, 28 May 2021 07:00:00 GMT"
Reliance Group among the top donors in India Inc’s COVID relief response: Read the details - OpIndia,"Mon, 10 May 2021 07:00:00 GMT"
Reliance Retail World’s 2nd Fastest Growing Retail Brand; Only Indian Firm In Top 250 List - Trak.in,"Mon, 10 May 2021 07:00:00 GMT"
Gautam Adani closes in on net worth of Asia's richest man Mukesh Ambani - India Today,"Fri, 21 May 2021 07:00:00 GMT"
"From Zero before pandemic, Reliance Jamnagar now produces over 11% of India's medical grade liquid oxygen for free supply to States - DeshGujarat","Sat, 01 May 2021 07:00:00 GMT"
LPU's 'Fashion School' records 100% placement amid pandemic - India TV News,"Wed, 26 May 2021 07:00:00 GMT"
Vijayawada: Reliance offers free fuel to emergency vehicles - The Hans India,"Tue, 18 May 2021 07:00:00 GMT"
Fact-check: Did Reliance pass off liquid oxygen imported from Saudi Arabia as its own? - Alt News,"Wed, 12 May 2021 07:00:00 GMT"
Any dividend income from shares is taxable - Mint,"Mon, 24 May 2021 07:00:00 GMT"
Inspiring Minds. Connecting People….Digitally! - The Sunday Guardian Live,"Sat, 29 May 2021 07:00:00 GMT"
4 untold stories from Mukesh Ambani’s childhood - South China Morning Post,"Wed, 26 May 2021 07:00:00 GMT"
"Tata acquires majority stake in BigBasket, invests $219 million - Mint","Fri, 28 May 2021 07:00:00 GMT"
Is the Ambani family facing its biggest PR crisis yet? - South China Morning Post,"Tue, 18 May 2021 07:00:00 GMT"
"A small mysterious fund topped India’s MF charts in the past year, here’s why - Mint","Fri, 28 May 2021 07:00:00 GMT"
Rajiv Gupta joins Tricolite as the CEO. - BW People,"Tue, 25 May 2021 07:00:00 GMT"
Rajiv Gupta quits Honda Cars; joins Tricolite as CEO - ET Auto,"Mon, 24 May 2021 07:00:00 GMT"
Investigating the U.S. Reliance on Foreign Suppliers - Federal Reserve Bank of St. Louis,"Thu, 13 May 2021 07:00:00 GMT"
Reliance Industries on a hiring spree for new clean energy business - The Economic Times,"Wed, 30 Jun 2021 07:00:00 GMT"
"Reliance Industries AGM today: From 5G smartphone to Aramco deal, here's what to expect - India Today","Thu, 24 Jun 2021 07:00:00 GMT"
Reliance Industries to face stiff competition in clean energy sphere - CNBC TV18,"Fri, 25 Jun 2021 07:00:00 GMT"
Indian refining giant Reliance unveils $10-bln green energy plan - Reuters,"Thu, 24 Jun 2021 07:00:00 GMT"
"Reliance Industries' balance sheet is strong, says Mukesh Ambani - Business Standard","Wed, 02 Jun 2021 07:00:00 GMT"
Reliance Industries unveils $10-billion plan for solar and energy storage - pv magazine India,"Fri, 25 Jun 2021 07:00:00 GMT"
Reliance Industries to give 5 years of salary to families of employees who died of Covid - Mint,"Thu, 03 Jun 2021 07:00:00 GMT"
A strong balance sheet and RIL’s growth plans’ - Fortune India,"Fri, 04 Jun 2021 07:00:00 GMT"
"Mukesh Ambani's Reliance Industries working on cheaper COVID-19 drug, affordable test kits - Business Today","Thu, 03 Jun 2021 07:00:00 GMT"
RIL AGM 2021: Here is what Reliance Industries' shareholders can expect from Mukesh Ambani's speech - Moneycontrol,"Thu, 24 Jun 2021 07:00:00 GMT"
"RIL AGM: Reliance Industries Plans To Invest Rs 75,000 Crore In New Energy Business - NDTV Profit","Thu, 24 Jun 2021 07:00:00 GMT"
Reliance Industries Limited - Facebook,"Tue, 01 Jun 2021 07:00:00 GMT"
"Automotive impact of Reliance Industries’ Rs 75,000cr investment in renewable energy explained - financialexpress.com","Fri, 25 Jun 2021 07:00:00 GMT"
Consumer Tech Becomes The Cash Cow Of Mukesh Ambani’s Reliance Empire - Inc42,"Thu, 24 Jun 2021 07:00:00 GMT"
ADNOC and Reliance Industries to set up petrochemical project in Abu Dhabi - Business Standard,"Wed, 30 Jun 2021 07:00:00 GMT"
Reliance charts mega plan for its renewable energy business - Mint,"Fri, 25 Jun 2021 07:00:00 GMT"
"#RIL has been recognized as one of ‘India’s Best Employers Among Nation Builders – 2021’ by the Great Place to Work®️ Institute. This recognition reinforces the trust that our people place in the management of our organization, the pride that our people exp - Facebook","Fri, 18 Jun 2021 07:00:00 GMT"
Reliance Ind’s joint CFO buys two sea-facing apartments in Mumbai’s Prabhadevi for Rs 40 cr - The Economic Times,"Mon, 21 Jun 2021 07:00:00 GMT"
"RIL to invest Rs 75,000 cr in clean energy, build 4 giga factories: Ambani - Business Standard","Fri, 25 Jun 2021 07:00:00 GMT"
Reliance Industries expects Saudi Aramco deal to formalise this year - Reuters,"Thu, 24 Jun 2021 07:00:00 GMT"
India’s biggest oil refiner to invest $10bn in clean energy ‘gigafactories’ - Climate Home News,"Fri, 25 Jun 2021 07:00:00 GMT"
"The Reliance Emerging Leaders Program (RELP) batch of 2021 received a grand welcome through interactions with leaders like Sh Srinivasan B and Sh Ashwani Prashara. Through these engaging and informative sessions, the RELs learned more about the - Facebook","Wed, 09 Jun 2021 07:00:00 GMT"
Saudi Aramco chairman Yasir Al-Rumayyan to join Reliance Industries board - ETHRWorld.com,"Thu, 24 Jun 2021 07:00:00 GMT"
"Reliance Industries raised Rs 3.24 lakh cr capital through equity sale, rights issue, asset monetisation: - The Economic Times","Thu, 24 Jun 2021 07:00:00 GMT"
Decoded: Reliance Industries’ shaky zero net debt boast in FY21 report - The New Indian Express,"Sun, 06 Jun 2021 07:00:00 GMT"
Reliance Industries earns a place in the sun with global solar play - Business Standard,"Sat, 26 Jun 2021 07:00:00 GMT"
Reliance Industries chairman Mukesh Ambani draws nil salary - Mint,"Thu, 03 Jun 2021 07:00:00 GMT"
Reliance Industries to build four giga factories in India - ETN News,"Thu, 24 Jun 2021 07:00:00 GMT"
"Five years salary, health and education for Reliance’s Covid victims - Capacity Media","Thu, 10 Jun 2021 07:00:00 GMT"
Reliance Industries sees big opportunity in global consensus against climate change - Moneycontrol,"Thu, 03 Jun 2021 07:00:00 GMT"
Reliance shuts unit at Jamnagar refinery - The Hindu,"Thu, 10 Jun 2021 07:00:00 GMT"
Edtech is the next frontier for RIL | Company Business News - Mint,"Sun, 13 Jun 2021 07:00:00 GMT"
RIL AGM: Reliance Retail Will Focus On These Key Areas In FY22 - NDTV Profit,"Fri, 25 Jun 2021 07:00:00 GMT"
"Reliance to Foray into Solar, Battery Storage, Green Hydrogen, and Fuel Cell Production - Mercomindia.com","Fri, 25 Jun 2021 07:00:00 GMT"
"RIL AGM: Jio Institute to start academic sessions this year, says Nita Ambani - Mint","Thu, 24 Jun 2021 07:00:00 GMT"
Reliance AGM 2021: Why Mukesh Ambani Should Launch An EV Company - Swarajyamag,"Thu, 24 Jun 2021 07:00:00 GMT"
Jio Institute to start academic sessions this year: Nita Ambani - Business Today,"Thu, 24 Jun 2021 07:00:00 GMT"
Here's how RIL stock fared on AGM days in last 12 years - The Economic Times,"Thu, 24 Jun 2021 07:00:00 GMT"
Reliance to set up a Fuel Cell Giga Factory in India - Team-BHP,"Thu, 24 Jun 2021 07:00:00 GMT"
"Reliance AGM 2021: RIL raised USD 44.4 bn - largest ever capital raised by any company in a year globally, confirms Chairman Mukesh Ambani - Zee Business","Thu, 24 Jun 2021 07:00:00 GMT"
Why Amazon Is Confronting the Richest Man in India (Published 2021) - The New York Times,"Tue, 15 Jun 2021 07:00:00 GMT"
Reliance Retail got sizable revenue in FY21 from digital commerce - Business Standard,"Thu, 03 Jun 2021 07:00:00 GMT"
"India's Reliance says FCCU unit at Jamnagar refinery shut, exports may be delayed - Reuters","Thu, 10 Jun 2021 07:00:00 GMT"
Reliance BP Mobility Limited sets up Mobile Fuel Bowser in Mumbai to provide Free Fuel to COVID Ambulances Mobile Fuel Bowser to be stationed at MCGM Worli Transport Garage Part of pan-India initiative by RBML and Reliance Foundation; is scheduled t - Facebook,"Wed, 02 Jun 2021 07:00:00 GMT"
"Reliance to invest Rs 75,000 crore in 3 years towards green energy initiatives: Mukesh Ambani - India Today","Thu, 24 Jun 2021 07:00:00 GMT"
Asia’s richest man Mukesh Ambani unveils $10bn green energy push - Al Jazeera,"Thu, 24 Jun 2021 07:00:00 GMT"
"Reliance to invest Rs 75,000 cr in new energy business over 3 years: Ambani - Business Standard","Thu, 24 Jun 2021 07:00:00 GMT"
Reliance bets on hydrogen boom; plans a gigafactory - ET Auto,"Fri, 25 Jun 2021 07:00:00 GMT"
Reliance producing over 11% of India's medical-grade liquid oxygen: Nita Ambani - Business Today,"Thu, 24 Jun 2021 07:00:00 GMT"
RIL AGM 2021 | Reliance Industries aims for net-zero carbon emission by 2035; here’s all you need to... - Moneycontrol,"Thu, 24 Jun 2021 07:00:00 GMT"
Reliance Industries begins recruiting for key positions as it readies clean energy venture - Times Now,"Wed, 30 Jun 2021 07:00:00 GMT"
"Reliance says FCCU unit at Jamnagar refinery shut, exports may be delayed - Mint","Thu, 10 Jun 2021 07:00:00 GMT"
"Reliance Continued Its Growth Plans Despite Covid, Now Has Strong Balance Sheets: Mukesh Ambani - News18","Thu, 03 Jun 2021 07:00:00 GMT"
Everything that Ambani announced at Reliance's Annual General Meeting 2021 - NewsBytes,"Thu, 24 Jun 2021 07:00:00 GMT"
Companies must go green to survive: Mukesh Ambani - Times of India,"Tue, 22 Jun 2021 07:00:00 GMT"
"Reliance Retail to grow 3x in next 3-5 years, create 10 lakh jobs: RIL Chairman - financialexpress.com","Thu, 24 Jun 2021 07:00:00 GMT"
Reliance AGM 2021 Highlights: What all happened at Mukesh Ambani's Annual General Meeting - The Economic Times,"Thu, 24 Jun 2021 07:00:00 GMT"
Mukesh Ambani throws a $10 billion clean energy challenge at rivals - Times of India,"Fri, 25 Jun 2021 07:00:00 GMT"
"Mukesh Ambani's Rs 75,000 cr solar power plan to challenge Adani, Tata - Business Today","Thu, 24 Jun 2021 07:00:00 GMT"
"Google expands Jio partnership with Indian smartphone, cloud tie-ups - Reuters","Thu, 24 Jun 2021 07:00:00 GMT"
Saudi Aramco chairman Yasir Al-Rumayyan joins Reliance board: Mukesh Ambani - Business Standard,"Thu, 24 Jun 2021 07:00:00 GMT"
A new Android smartphone and 5G partnership with Jio - Google Blog,"Thu, 24 Jun 2021 07:00:00 GMT"
"If Reliance is serious about renewables, the era of oil is truly ending - Quartz","Thu, 24 Jun 2021 07:00:00 GMT"
India's Reliance and ADNOC join forces in chemical project - Reuters,"Tue, 29 Jun 2021 07:00:00 GMT"
Reliance Retail set to grow threefold in the next 3-5 years: Mukesh Ambani - Mint,"Thu, 24 Jun 2021 07:00:00 GMT"
Why is Mukesh Ambani building an international undersea cable system? - Quartz,"Wed, 02 Jun 2021 07:00:00 GMT"
"Reliance Jio 5G tested for 1Gbps, to partner with Google for next-gen network - Mint","Thu, 24 Jun 2021 07:00:00 GMT"
Reliance to focus on new materials and green chemicals - Indian Chemical News,"Fri, 25 Jun 2021 07:00:00 GMT"
"JioPhone Next: Reliance Jio, Google Launch Budget Smartphone - NDTV Profit","Thu, 24 Jun 2021 07:00:00 GMT"
RIL 44th AGM: Here's the full text of Mukesh Ambani's speech - The Economic Times,"Thu, 24 Jun 2021 07:00:00 GMT"
"Reliance Industries Ltd RIL To Invest ₹75,000 Crore In Green Energy Initiative. - Startup Story","Fri, 25 Jun 2021 07:00:00 GMT"
"ADNOC, Reliance Industries ink pact for chemical projects at TA’ZIZ in Ruwais - ProjectsMonitor","Wed, 30 Jun 2021 07:00:00 GMT"
Two American retailers are giving some of India’s largest legacy businesses a run for their money - Quartz,"Wed, 09 Jun 2021 07:00:00 GMT"
Mukesh Ambani announces smartphone in partnership with Google - Jio Phone Next - Business Today,"Thu, 24 Jun 2021 07:00:00 GMT"
Reliance Retail aims three-fold growth in 3-5 years - financialexpress.com,"Fri, 25 Jun 2021 07:00:00 GMT"
Reliance AGM 2021: Mukesh Ambani To Take On Adani With Investments Of $10 Bn In New Energy Business - ABP Live English,"Thu, 24 Jun 2021 07:00:00 GMT"
Mukesh Ambani took home no salary in FY21 amid Covid-19 pandemic - Business Today,"Wed, 02 Jun 2021 07:00:00 GMT"
What Reliance’s push towards green hydrogen power means for India’s EV ecosystem - Moneycontrol,"Fri, 25 Jun 2021 07:00:00 GMT"
"Reliance-Google announce world's most affordable 4G smartphone, JioPhone Next - YourStory.com","Thu, 24 Jun 2021 07:00:00 GMT"
Tata takes on Reliance in online pharmacy battle with 1MG acquisition: 10 points - Mint,"Thu, 10 Jun 2021 07:00:00 GMT"
Ambani’s goal of ruling Indian smartphone market in trouble - Al Jazeera,"Wed, 16 Jun 2021 07:00:00 GMT"
"JioPhone Next smartphone launched, Google says it runs special version of Android - India Today","Thu, 24 Jun 2021 07:00:00 GMT"
Intel to work with India’s Reliance Jio on 5G network technology - Reuters,"Mon, 21 Jun 2021 07:00:00 GMT"
"RIL rescue centre likely to get leopards from Himachal Pradesh, Uttarakhand - Times of India","Tue, 15 Jun 2021 07:00:00 GMT"
Reliance to establish and enable 100 GW solar energy - Indian Chemical News,"Mon, 28 Jun 2021 03:03:52 GMT"
"Bigbasket, Curefit, 1mg: How Tata Group's growing digital ambitions may be taking it closer to Reliance - YourStory.com","Fri, 11 Jun 2021 07:00:00 GMT"
"ADNOC, Reliance sign strategic partnership for world-scale chemical projects at TA'ZIZ in Abu Dhabi's Ruwais - ANI News","Tue, 29 Jun 2021 07:00:00 GMT"
Jio to partner Google Cloud on 5G technology to provide a billion Indians superior connectivity - Telecom Review Asia,"Fri, 25 Jun 2021 07:00:00 GMT"
JioPhone Next by Google launched; to be available from September 10 - ET Telecom,"Thu, 24 Jun 2021 07:00:00 GMT"
Reliance to provide free fuel to Covid ambulances in Gurugram - Mint,"Tue, 01 Jun 2021 07:00:00 GMT"
Is Reliance Jio Signalling A Tariff Hike? - Capitalmind,"Mon, 21 Jun 2021 07:00:00 GMT"
"Silicon Valley gave Asia’s richest man billions, but things aren’t all going to plan - CNN","Thu, 24 Jun 2021 07:00:00 GMT"
Is it possible for Reliance’s New Renewable Energy Business to become as successful as Jio? - Trade Brains,"Tue, 29 Jun 2021 07:00:00 GMT"
Reliance BP Mobility To Build 24 EV Battery Swap Stations - Saur Energy International,"Sat, 05 Jun 2021 07:00:00 GMT"
Ajio accounts for 25% of Reliance Retail’s apparel biz - Mint,"Fri, 25 Jun 2021 07:00:00 GMT"
Missed Opportunities by Indian Chemical Industry- A Few Case Studies Amongst Many - Chemical Industry Digest,"Tue, 01 Jun 2021 07:00:00 GMT"
Reliance retail to create 10 lakh jobs in the near future - HR Katha,"Fri, 25 Jun 2021 07:00:00 GMT"
Jio Institute: What do we know so far about Mukesh Ambani’s “Institute of Eminence” - Quartz,"Mon, 28 Jun 2021 07:00:00 GMT"
Reliance WhatsApp chatbot launched; Here is how to download and why you may need it - HT Tech,"Wed, 23 Jun 2021 04:42:57 GMT"
Tech promoters top list of cash recipients; family-owned groups earn less - Business Standard,"Mon, 21 Jun 2021 07:00:00 GMT"
Reliance Industries lags peers in rewarding investors with cash pay-outs - Business Standard,"Tue, 06 Jul 2021 07:00:00 GMT"
This RIL parameter rose 158% in one year | Company Business News - Mint,"Thu, 15 Jul 2021 07:00:00 GMT"
Bombay High Court grants relief to Reliance Industries in BKC land development case - The Economic Times,"Mon, 12 Jul 2021 07:00:00 GMT"
How the Facebook-Reliance combine and the farm laws pave the way for digital colonisation - The Caravan,"Tue, 13 Jul 2021 07:00:00 GMT"
"Reliance Industries Q1 Results: Net Profit Falls 7% YoY to ₹12,273 Cr - Groww","Mon, 26 Jul 2021 07:00:00 GMT"
Reliance Industries eyes stake in home styling brand Portico - Business Today,"Tue, 06 Jul 2021 07:00:00 GMT"
"Reliance Retail Ventures Limited Announces Acquisition of Controlling Stake In Just Dial Limited For A Total Consideration of Rs 3,497 crores Reliance Retail Ventures Limited to Hold 40.95% And Would Make An Open Offer To Acquire Upto 26.0% In Accord - Facebook","Fri, 16 Jul 2021 07:00:00 GMT"
"Dhirubhai Ambani: From gas station attendant to Founder of Reliance Industries Group; awards, achievements - financialexpress.com","Tue, 06 Jul 2021 07:00:00 GMT"
Aramco chairman Yasir Al-Rumayyan joins Reliance Industries board - ETHRWorld.com,"Thu, 22 Jul 2021 07:00:00 GMT"
Reliance New Energy Solar Incorporated as the Wholly-Owned Subsidiary of Reliance Inds - Mercomindia.com,"Wed, 14 Jul 2021 07:00:00 GMT"
Anant Ambani’s growing presence at Reliance Industries - Quartz,"Tue, 06 Jul 2021 07:00:00 GMT"
Reliance Retail's Acquisition of Just Dial: Explained - marketfeed,"Fri, 23 Jul 2021 07:00:00 GMT"
Reliance Retail picks up 66.9% stake in JD - Hindustan Times,"Sat, 17 Jul 2021 07:00:00 GMT"
Anant Ambani appointed as Director for two Reliance solar divisions - Construction World,"Tue, 06 Jul 2021 07:00:00 GMT"
"Reliance Industries is considering purchasing REC, a Norwegian solar module manufacturer - Trade Brains","Thu, 08 Jul 2021 07:00:00 GMT"
"Reliance Retail acquires majority stake in Just Dial for Rs 3,497 cr - India Shipping News","Sat, 17 Jul 2021 07:00:00 GMT"
"Reliance's O2C, new energy business may be valued over $100 billion: Report - The Economic Times","Sun, 18 Jul 2021 07:00:00 GMT"
Reliance Industries Limited - Facebook,"Fri, 23 Jul 2021 07:00:00 GMT"
Tata vs Reliance: A two-front battle -- renewable energy and retail - Business Standard,"Mon, 12 Jul 2021 07:00:00 GMT"
"Reliance Industries’ O2C, new energy biz may be valued over $100 Billion: Report - Trade Brains","Mon, 19 Jul 2021 07:00:00 GMT"
Youngest Ambani takes seat on boards of RIL’s 2 new solar cos - Times of India,"Mon, 05 Jul 2021 07:00:00 GMT"
"Q1 results: Reliance Jio net profit rises 45% to Rs 3,651 crore - Business Standard","Sat, 24 Jul 2021 07:00:00 GMT"
India’s Mukesh Ambani sparks succession talk as third child joins Reliance - South China Morning Post,"Sat, 10 Jul 2021 07:00:00 GMT"
"Reliance Foundation administers over 10 lakh COVID vaccines to RIL employees, family members - Business Today","Mon, 26 Jul 2021 07:00:00 GMT"
Reliance in talks to buy stake in home fashion brand Portico - The Economic Times,"Mon, 05 Jul 2021 07:00:00 GMT"
Cover Story: Inside Mukesh Ambani's Green Gambit - Forbes India,"Wed, 21 Jul 2021 07:00:00 GMT"
How big is Mukesh Ambani’s Reliance Retail? It’s Future Plans & Growth Prospects! - Trade Brains,"Mon, 05 Jul 2021 07:00:00 GMT"
"Reliance Retail to acquire 66.95% stake in Justdial for Rs 3,497 cr - Business Today","Fri, 16 Jul 2021 07:00:00 GMT"
Reliance Retail acquires controlling stake in Just Dial for $469 million - TechCrunch,"Fri, 16 Jul 2021 07:00:00 GMT"
Oil Ministry authorises new companies to sell auto fuels in the country - Business Standard,"Mon, 19 Jul 2021 07:00:00 GMT"
Reliance uses Aramco link to sign big petrochemical deal in Abu Dhabi - Asia Financial,"Thu, 01 Jul 2021 07:00:00 GMT"
Asia's Richest Mukesh Ambani Makes Money At A Faster Pace Than India's Most Valued Firm Reliance - ABP Live English,"Sat, 31 Jul 2021 07:00:00 GMT"
Reliance Retail acquires majority stake in Just Dial - Exchange4media,"Fri, 16 Jul 2021 07:00:00 GMT"
Know which funds own a particular stock - Morningstar,"Wed, 21 Jul 2021 07:00:00 GMT"
"Even as Reliance is establishing itself as a tech major, its online presence remains poor - Scroll.in","Tue, 06 Jul 2021 07:00:00 GMT"
How this startup snaps up clients like Reliance Industries - Tech in Asia,"Fri, 30 Jul 2021 07:00:00 GMT"
RIL forms new energy company - Indian Chemical News,"Tue, 13 Jul 2021 05:51:51 GMT"
"Business Tycoons Mukesh Ambani, Gautam Adani in a New Face-off. Here's Why - India.Com","Wed, 07 Jul 2021 07:00:00 GMT"
"Reliance Retail Acquires Majority Stake In Just Dial for INR 3,497 Cr; VSS Mani To Remain MD & CEO - Inc42","Fri, 16 Jul 2021 07:00:00 GMT"
Generic Pharmasec Ltd. successfully executes an order from Reliance Group - ThePrint,"Thu, 29 Jul 2021 07:00:00 GMT"
Why did Reliance Retail buy Just Dial? - CAclubindia,"Wed, 28 Jul 2021 07:00:00 GMT"
Ambani to Adani: how 6 of India’s richest became billionaires - South China Morning Post,"Thu, 22 Jul 2021 07:00:00 GMT"
"The Ambanis, reunited: their first public gathering of 2021 - South China Morning Post","Tue, 13 Jul 2021 07:00:00 GMT"
Man Speaking Against Reliance Misidentified as Himalaya Drug Co's Owner - The Quint,"Tue, 20 Jul 2021 07:00:00 GMT"
Reliance Retail acquired a majority stake of 66 percent in Just Dial - Passionate In Marketing,"Mon, 19 Jul 2021 07:00:00 GMT"
Cricketer Suryakumar Yadav signs deal with RISE Worldwide - Exchange4media,"Fri, 16 Jul 2021 07:00:00 GMT"
Reliance & Just Dial: Apples and oranges or a symbiotic win-win deal? - The Federal News,"Mon, 19 Jul 2021 07:00:00 GMT"
Here are the top 10 stocks held by NPS equity funds - Moneycontrol,"Fri, 30 Jul 2021 07:00:00 GMT"
"After Tata, Ambani Dials 8888888888 In Talks To Buy Justdial For Over Rs 6,500 Cr - ABP Live English","Thu, 15 Jul 2021 07:00:00 GMT"
The Mukesh Ambani essay in Times of India argues that India at 100 could be as rich as the United States and China Link: https://bit.ly/2UCJht8 #MukeshAmbani - Facebook,"Fri, 23 Jul 2021 07:00:00 GMT"
"These 6 Firms Allowed To Sell Petrol/Diesel To Consumers, Commercial Establishments (Full List) - Trak.in","Wed, 21 Jul 2021 07:00:00 GMT"
Reliance Retail Ventures (RRVL) to procure shares of JustDial up to 26% - Business Outreach,"Tue, 20 Jul 2021 07:00:00 GMT"
Why Reliance Industries Successor plan is being discussed in media - Thepost24,"Sat, 17 Jul 2021 10:11:47 GMT"
Mukesh Ambani Owns The Largest Orchard Of Mangoes In Asia For A Reason: Did You Know? - ED Times,"Thu, 29 Jul 2021 07:00:00 GMT"
"India News | ⚡Reliance Industries Invests Rs 1 Lakh Cash in 10,000 Equity Shares of New Energy Arm RNESL - LatestLY","Mon, 12 Jul 2021 18:41:02 GMT"
Business: Anant Ambani appointed to board of RIL's 2 new companies: Report - zoomnews.in,"Tue, 06 Jul 2021 07:00:00 GMT"
Reliance Industries shuts Nagothane manufacturing unit till Aug 25 - Business Today,"Thu, 19 Aug 2021 07:00:00 GMT"
