Headline,Published Date
"PDEU at forefront of education, research in energy technologies: Mukesh Ambani at institute's 11th convocation - India TV News","Sat, 02 Dec 2023 08:00:00 GMT"
Dhirubhai Ambani Birth Anniversary 2023: 5 unknown facts about business tycoon - Mint,"Thu, 28 Dec 2023 08:00:00 GMT"
Reliance Family Day: Mukesh Ambani underlines vision for the future - Times of India,"Thu, 28 Dec 2023 08:00:00 GMT"
Moody's affirms RIL's Baa2 ratings; outlook stable - ET EnergyWorld,"Thu, 14 Dec 2023 08:00:00 GMT"
Reliance Industries emerges as largest wealth creator in 5 years: Motilal Oswal report - Moneycontrol,"Thu, 14 Dec 2023 08:00:00 GMT"
MPW 2023: How Isha Ambani is ensuring Reliance Retail’s dominance continues - Business Today,"Tue, 12 Dec 2023 08:00:00 GMT"
"Reliance to invest Rs 75,000 core in powering India’s future sustainability - Manufacturing Today India","Tue, 19 Dec 2023 08:00:00 GMT"
"Reliance Industries May Absorb Star India as Part of Merger With Disney, Here’s What You Need to Know - IGN India","Tue, 26 Dec 2023 08:00:00 GMT"
"Bharat Petroleum may join Reliance, IOCL to secure oil from Venezuela - The Economic Times","Wed, 13 Dec 2023 08:00:00 GMT"
Why is Mukesh Ambani scouring sugar mills across India? - The Economic Times,"Fri, 08 Dec 2023 08:00:00 GMT"
Reliance in talks with sugar mill operators for biomass plant plans: Report - Hindustan Times,"Thu, 07 Dec 2023 08:00:00 GMT"
"Disney, Reliance plan London meeting for India media merger talks: Reuters - CNBC TV18","Wed, 13 Dec 2023 08:00:00 GMT"
Bajaj Group becomes fifth conglomerate to breach ₹10 lakh crore in market capitalisation - CNBC TV18,"Mon, 04 Dec 2023 08:00:00 GMT"
Dunzo’s survival hinges on Reliance Retail commitment to funds - The Economic Times,"Mon, 11 Dec 2023 08:00:00 GMT"
Mukesh Ambani's Reliance-Disney Star deal explained: 10 points on mega-merger - Hindustan Times,"Mon, 25 Dec 2023 08:00:00 GMT"
RIL turns to sugar mills to fuel green energy plans - The Economic Times,"Thu, 07 Dec 2023 08:00:00 GMT"
Honeywell Boosts Safety and Efficiency for Reliance Life Sciences - financialexpress.com,"Tue, 19 Dec 2023 08:00:00 GMT"
India to resume import of oil from Venezuela after 3 years as US sanctions on Caracas ease - The Indian Express,"Fri, 01 Dec 2023 08:00:00 GMT"
'Never complacent...Reliance Industries will be among top...' - Mukesh Ambani's BIG PLANS - ET Now,"Sat, 30 Dec 2023 08:00:00 GMT"
Reliance targets Mumbai's wealthy with new shopping mall - Nikkei Asia,"Sun, 03 Dec 2023 08:00:00 GMT"
"NCLT Mumbai Approves Resolution Plan For Reliance Communications Infrastructure Ltd., Valued At Rs 455.9... - Live Law","Fri, 22 Dec 2023 08:00:00 GMT"
"Disney, Reliance sign pre-deal agreement, mega-merger to be done by Feb - Business Standard","Mon, 25 Dec 2023 08:00:00 GMT"
RIL and DBS Bank India collaborate to promote CBG project - Indian Chemical News,"Sun, 17 Dec 2023 17:56:18 GMT"
SAT quashes Sebi's fine on Jio Financial on F&O manipulation - The New Indian Express,"Wed, 13 Dec 2023 08:00:00 GMT"
"Sterling and Wilson Renewable raises ₹1,500 crore via QIP - The Hindu","Fri, 15 Dec 2023 08:00:00 GMT"
"SAT quashes Sebi's order against Mukesh Ambani, 2 others in RPL case - Business Standard","Mon, 04 Dec 2023 08:00:00 GMT"
"2023 for Conglomerates: Next gen in decision making roles and thrust on new businesses, listings - CNBC TV18","Fri, 22 Dec 2023 08:00:00 GMT"
Jio Working On 'Bharat GPT' With IIT-B; To Launch OS For Televisions: Akash Ambani - outlookbusiness.com,"Thu, 28 Dec 2023 08:00:00 GMT"
‘Undue concession’ to Reliance in Maharashtra led to Rs 41.1 cr loss: CAG - Newslaundry,"Wed, 20 Dec 2023 08:00:00 GMT"
Why an appellate Tribunal has quashed SEBI’s order against Mukesh Ambani - The Indian Express,"Tue, 05 Dec 2023 08:00:00 GMT"
"Digital Connexion Completes Formation of Indian Data Centre Venture with Brookfield Infrastructure, Reliance Industries and Digital Realty - CRN - India","Wed, 13 Dec 2023 08:00:00 GMT"
"Educational qualifications of Rs 1663000 crore Reliance Industries' board: Mukesh Ambani, Akash, Isha Ambani, others - DNA India","Fri, 08 Dec 2023 08:00:00 GMT"
RIL share price | Why the target price on the Reliance stock is rising - CNBC TV18,"Tue, 19 Dec 2023 08:00:00 GMT"
Reliance Communications Infra to be a Mukesh Ambani firm - Insolvency Tracker,"Wed, 20 Dec 2023 08:00:00 GMT"
Reliance Teams With DBS Bank For Biogas Initiative - Adda247,"Thu, 14 Dec 2023 08:00:00 GMT"
No takers for rupee payment for oil imports - ET EnergyWorld,"Mon, 25 Dec 2023 08:00:00 GMT"
Reliance and Disney in advanced talks for mega-merger in Indian media: Report - Business Today,"Tue, 12 Dec 2023 08:00:00 GMT"
Zee-Sony flip-flop puts Disney-RIL deal in spotlight - financialexpress.com,"Wed, 20 Dec 2023 08:00:00 GMT"
Dhirubhai Ambani's entrepreneurial magic: 6 lessons to learn - YourStory.com,"Wed, 27 Dec 2023 08:00:00 GMT"
Anil Ambani's holding in Reliance Communications not worth even Rs 1 crore now! Owns over 18 lakh shares - ET Now,"Fri, 15 Dec 2023 08:00:00 GMT"
Top Companies for CSR and Sustainability in 2023 - The CSR Journal,"Thu, 28 Dec 2023 08:00:00 GMT"
Top wealth creating stocks in India: Reliance tops biggest wealth creator list; Adani Enterprises bags fi - Times of India,"Thu, 14 Dec 2023 08:00:00 GMT"
Dhirubhai Ambani birth anniversary: A look at inspiring journey and achievements of India’s most successful en - CNBC TV18,"Thu, 28 Dec 2023 08:00:00 GMT"
"Brookfield-Reliance-Digital Realty JV in India complete, renamed Digital Connexion - W.Media","Wed, 13 Dec 2023 08:00:00 GMT"
"NCLT Mumbai approves sale of Reliance Communications’ real estate assets, shares - Mint","Fri, 15 Dec 2023 08:00:00 GMT"
Reliance and Disney's streaming and TV assets in India - Reuters,"Fri, 15 Dec 2023 08:00:00 GMT"
"Mukesh Ambani talks on 'data, AI', 'world's Top 10 conglomerates' dream - Hindustan Times","Thu, 28 Dec 2023 08:00:00 GMT"
"RIL Share Price Target 2023: Jefferies Bullish on Mukesh Ambani-led Reliance Industries, Retains 'BUY' Tag - Times Now","Wed, 06 Dec 2023 08:00:00 GMT"
'My father didn't believe...': Jio's Akash Ambani on Mukesh Ambani's reaction when he got invitation to speak at IIT Bombay - Business Today,"Wed, 27 Dec 2023 08:00:00 GMT"
"India Glycols soars 11% on winning ethanol supply order from OMCs, Reliance - Business Standard","Tue, 19 Dec 2023 08:00:00 GMT"
Rs 27 lakh crore! That's how much wealth these 5 stocks created in 5 years - India Today,"Tue, 19 Dec 2023 08:00:00 GMT"
"Reliance Will Be Among World's Top 10 Companies; Must Focus on AI, Data, And Youth: Mukesh Ambani - News18","Fri, 29 Dec 2023 08:00:00 GMT"
Mukesh Ambani’s Significant Educational Qualifications - India.Com,"Thu, 14 Dec 2023 08:00:00 GMT"
"Year Ender 2023 | What made headlines in world of business: Adani-Hindenburg Report row, Twitter rebrands as X, Narayana Murthy sparks 70-hour work week debate, birth of Reliance’s Jio Financial - Business Today","Sun, 24 Dec 2023 08:00:00 GMT"
India-based KPIT Unveils Indigenous Sodium-Ion Battery Technology - Mercomindia.com,"Thu, 14 Dec 2023 08:00:00 GMT"
Reliance Industries committed to make new investments in Tamil Nadu: Mukesh Ambani - The Hindu,"Sun, 07 Jan 2024 08:00:00 GMT"
Big becomes bigger! Reliance Industries market value crosses Rs 18 lakh crore - The Economic Times,"Thu, 11 Jan 2024 08:00:00 GMT"
"Reliance Industries shares rally 3%, hit 52-week high; here’s why - Mint","Wed, 10 Jan 2024 08:00:00 GMT"
Reliance Industries shares fall over 1% after Q3 earnings - BusinessLine,"Sat, 20 Jan 2024 08:00:00 GMT"
Earnings from O2C division may remain volatile for Reliance Industries - Business Standard,"Sun, 21 Jan 2024 08:00:00 GMT"
Reliance Industries Q3 results highlight: Ambani-led company's profit up by 9.3% - Hindustan Times,"Fri, 19 Jan 2024 08:00:00 GMT"
"RIL Q3 results: Net profit rises 11% to Rs 19,641 cr; margin expands 210 bps - Business Today","Fri, 19 Jan 2024 08:00:00 GMT"
Reliance Industries-Analysts maintain bullish 2024 outlook led by Retail and Jio . Jefferies sees more than 20% upside - Mint,"Fri, 05 Jan 2024 08:00:00 GMT"
"Reliance Industries to invest in renewable energy, green hydrogen in Tamil Nadu: Mukesh Ambani - The Economic Times","Sun, 07 Jan 2024 08:00:00 GMT"
Reliance Industries most valuable Indian company: Hurun Global 500 2023 - Business Standard,"Wed, 31 Jan 2024 08:00:00 GMT"
Reliance Industries remains on analysts’ radar as retail momentum persists - BusinessLine,"Sat, 20 Jan 2024 08:00:00 GMT"
Mukesh Ambani's Reliance Industries sees ₹1.2 lakh crore boost in market value - Hindustan Times,"Mon, 29 Jan 2024 08:00:00 GMT"
"Reliance Q3 results: Net profit up 11% to ₹19,641 crore; EBITDA up 17% led by oil and gas, retail segments - Mint","Fri, 19 Jan 2024 08:00:00 GMT"
Reliance Industries Q3 Results Live Updates: PAT at Rs 17265 cr vs ET NOW poll of Rs 16944 cr - The Economic Times,"Fri, 19 Jan 2024 08:00:00 GMT"
"Reliance Industries to see valuation re-rating led by New Energy business, says Nuvama Equities; raises target price - Mint","Thu, 18 Jan 2024 08:00:00 GMT"
"Reliance Q3 Results Highlights: Net profit up 11% to ₹19,641 crore; O2C revenue down, retail, telecom arms thrive | Company Business News - Mint","Fri, 19 Jan 2024 08:00:00 GMT"
Reliance Industries to commission green energy giga complex in Jamnagar in H2 of 2024 - Mint,"Sun, 21 Jan 2024 08:00:00 GMT"
Multibagger penny stock: Reliance funding fuels rally in Alok Industries shares by 65% in five straight sessions - Mint,"Mon, 08 Jan 2024 08:00:00 GMT"
"Alok Industries share price surges 20% after Reliance Industries invests ₹3,300 crore - Mint","Tue, 02 Jan 2024 08:00:00 GMT"
Reliance Industries’ market capitalisation crosses ₹19.5 lakh crore: How does it stack up against major global firms? - Mint,"Mon, 29 Jan 2024 08:00:00 GMT"
"Reliance Industries Q3 results: Net profit up 9.3%, misses estimates - Business Standard","Fri, 19 Jan 2024 08:00:00 GMT"
Reliance Industries first in India to receive ISCC-Plus certification - Sustainable Plastics,"Tue, 02 Jan 2024 08:00:00 GMT"
Reliance Industries gains most since September 2020 to a record high; Market Cap at ₹19.5 lakh crore - CNBC TV18,"Mon, 29 Jan 2024 08:00:00 GMT"
"Reliance share price hits record high, market cap crosses ₹19 lakh crore - Mint","Mon, 29 Jan 2024 08:00:00 GMT"
Reliance Industries Shares Hit Record High As Crude Surges - NDTV Profit,"Mon, 29 Jan 2024 08:00:00 GMT"
Reliance Industries Ltd rides PLI schemes to close in on $1-1.5/kg Green H2 target - The Economic Times,"Mon, 22 Jan 2024 08:00:00 GMT"
"TN GIM 2024: Reliance Industries to invest in renewable energy, green hydrogen in Tamil Nadu, says Mukesh... - Moneycontrol","Sun, 07 Jan 2024 08:00:00 GMT"
New year wishlist for Mukesh Ambani from 37 lakh shareholders of Reliance Industries - The Economic Times,"Mon, 08 Jan 2024 08:00:00 GMT"
Reliance Industries Limited - Facebook,"Thu, 25 Jan 2024 08:00:00 GMT"
"Reliance shares may rally over 20%, say analysts - CNBC TV18","Tue, 23 Jan 2024 08:00:00 GMT"
"Reliance Q3 Results Highlights: Jio, Retail shine; O2C revenue declines; 5 key highlights from RIL Q3 earnings - Mint","Fri, 19 Jan 2024 08:00:00 GMT"
Reliance Industries shares rally; Mukesh Ambani enters $100 billion club - Business Today,"Fri, 12 Jan 2024 08:00:00 GMT"
Reliance share price at record high: What exactly is happening and why - Hindustan Times,"Mon, 29 Jan 2024 08:00:00 GMT"
"Disney, Reliance start antitrust diligence on India media merger -sources - Reuters","Thu, 04 Jan 2024 08:00:00 GMT"
"Reliance Industries Q3 Preview: Profit, Revenue Seen Rising, Operating Numbers Could Fall - NDTV Profit","Thu, 18 Jan 2024 08:00:00 GMT"
Reliance sells REC Solar Norway for $22 million - ET EnergyWorld,"Tue, 16 Jan 2024 08:00:00 GMT"
India’s Reliance Industries to invest $10bn in green hydrogen project - Bioenergy Insight,"Mon, 08 Jan 2024 08:00:00 GMT"
"Reliance Q3 Results highlights: Net profit rises 11% to Rs 19,641 crore, boosted by retail, Jio, oil & gas earnings - Moneycontrol","Fri, 19 Jan 2024 08:00:00 GMT"
Reliance Industries Achieves India’s First ISCC-Plus Certification - Adda247,"Thu, 04 Jan 2024 08:00:00 GMT"
Reliance Industries-Disney Star merger: Is a bumpy road ahead for beleaguered Zee? - Business Today,"Tue, 23 Jan 2024 08:00:00 GMT"
RIL spends $1.5 bn in acquisitions for its new energy business - BusinessLine,"Mon, 22 Jan 2024 08:00:00 GMT"
Mukesh Ambani’s Reliance Industries set for record as Red Sea crisis proves a boon - ET EnergyWorld,"Mon, 29 Jan 2024 08:00:00 GMT"
"Reliance was, is and will remain a Gujarati company: Mukesh Ambani - Times of India","Thu, 11 Jan 2024 08:00:00 GMT"
"Reliance Industries, Disney start antitrust diligence on media merger: Report - Business Today","Thu, 04 Jan 2024 08:00:00 GMT"
Reliance Industries Unveils Giga Energy Complex Set for Revolutionary Launch in Green Technology Production - SolarQuarter,"Mon, 22 Jan 2024 08:00:00 GMT"
Reliance to sell REC’s polysilicon manufacturing arm for $22 million - pv magazine India,"Tue, 16 Jan 2024 08:00:00 GMT"
"Reliance Industries Q3 results: Profit up 9% to ₹17,625 cr in Dec quarter’ - Fortune India","Fri, 19 Jan 2024 08:00:00 GMT"
Reliance launches entry-level recruitment drive for engineer graduates across business verticals. Here’s how to apply - Mint,"Fri, 12 Jan 2024 08:00:00 GMT"
"RIL Unit, Greenko JV among 8 chosen for electrolyser incentive scheme - The Economic Times","Thu, 11 Jan 2024 08:00:00 GMT"
Reliance-Brookfield to open data centre next week: What makes entry into Adani's turf important and more - Times of India,"Mon, 08 Jan 2024 08:00:00 GMT"
Reliance Industries' REC Solar Holdings Divests REC Norway Stake to Elkem ASA for USD 22 Million - SolarQuarter,"Tue, 16 Jan 2024 08:00:00 GMT"
Reliance Industries Q3 Review: Outlook Positive Despite Stress In O2C Segment - NDTV Profit,"Sat, 20 Jan 2024 08:00:00 GMT"
Reliance Industries announces holiday for all its offices on January 22 - CNBC TV18,"Fri, 19 Jan 2024 08:00:00 GMT"
"Reliance net profit rises 9%, planned shutdown at oil refinery subdues earnings - ET EnergyWorld","Sat, 20 Jan 2024 08:00:00 GMT"
Reliance Industries Limited - Facebook,"Fri, 26 Jan 2024 08:00:00 GMT"
"Mukesh Ambani's Reliance Industries net profit rises 11% to Rs 19,641Cr in Q3 - Indian Startup News","Sat, 20 Jan 2024 08:00:00 GMT"
Disney and Reliance ‘enter agreement’ to combine Hotstar and Viacom18 in India - SportsPro,"Tue, 02 Jan 2024 08:00:00 GMT"
Brookfield-Reliance JV opens data centre in Chennai - financialexpress.com,"Sat, 13 Jan 2024 08:00:00 GMT"
Reliance to set up carbon fibre facility in Gujarat - BusinessLine,"Wed, 10 Jan 2024 08:00:00 GMT"
"RIL, int'l partners launch data centre in Chennai, their first in India - Business Standard","Fri, 12 Jan 2024 08:00:00 GMT"
Reliance Industries announces holiday for all its offices on January 22 - Mint,"Fri, 19 Jan 2024 08:00:00 GMT"
"Reliance, Jindal among six firms to get incentives for making electrolysers - Business Standard","Mon, 15 Jan 2024 08:00:00 GMT"
"Mukesh Ambani calls Reliance Gujarati firm, says most successful PM ever is... - Hindustan Times","Wed, 10 Jan 2024 08:00:00 GMT"
Reliance Industries unable to comment on Disney's India division valuation speculation - afaqs!,"Tue, 30 Jan 2024 08:00:00 GMT"
Gujarat to see major boost in green energy with Reliance's multi-billion dollar investment - ET EnergyWorld,"Wed, 10 Jan 2024 08:00:00 GMT"
Reliance ‘Jio Brain’: How new AI-powered platform may impact your phone’s connectivity - Business Today,"Wed, 31 Jan 2024 08:00:00 GMT"
"Reliance Jio Q3 results: Net profit rises 12% to Rs 5,208 cr; ARPU rises 2% to Rs 181.7 - Business Today","Fri, 19 Jan 2024 08:00:00 GMT"
"Ambani, Adani commit huge investments at Vibrant Gujarat Summit - The Hindu","Wed, 10 Jan 2024 08:00:00 GMT"
Reliance To Commission New Energy Giga Complex This Year - outlookbusiness.com,"Mon, 22 Jan 2024 08:00:00 GMT"
"Jio, Reliance Retail to steal the show in RIL’s report card for Q3? - Moneycontrol","Wed, 17 Jan 2024 08:00:00 GMT"
Reliance’s life with Metro - financialexpress.com,"Wed, 17 Jan 2024 08:00:00 GMT"
"Coca-Cola India and Reliance Retail Team Up for 'Bhool Na Jana, Plastic Bottle Lautana' PET Collection and Recycling Initiative - PR Newswire","Tue, 16 Jan 2024 08:00:00 GMT"
"Vibrant Gujarat Summit 2024: Reliance is, was and will always remain a Gujarati company, says Mukesh Ambani - Business Today","Wed, 10 Jan 2024 08:00:00 GMT"
"Reliance, Brookfield set to open data center in Chennai: Ambani - ETCIO.com","Mon, 08 Jan 2024 08:00:00 GMT"
"Reliance Industries Shares Decline After Q3 Profit Falls, Misses Estimates - NDTV Profit","Sat, 20 Jan 2024 08:00:00 GMT"
Nifty 50 records biggest intraday jump in nearly 2 months: RIL contributes 37% to index’s overall rally - Mint,"Mon, 29 Jan 2024 08:00:00 GMT"
"‘You are like my son’: When Nitin Gadkari rejected Reliance's bid and upset Dhirubhai Ambani, but… - Business Today","Mon, 29 Jan 2024 08:00:00 GMT"
Reliance Industries launches online GET Programme for national talent pool inclusion - Manufacturing Today India,"Mon, 15 Jan 2024 08:00:00 GMT"
Walt Disney's India unit market valuation halves in Reliance merger talks - Business Standard,"Thu, 25 Jan 2024 08:00:00 GMT"
Mukesh Ambani owns type of Boeing involved in Alaska Air accident - Business Standard,"Mon, 08 Jan 2024 08:00:00 GMT"
Ram Mandir opening: Reliance Industries declares holiday for all its offices on Jan 22 - Business Today,"Fri, 19 Jan 2024 08:00:00 GMT"
"Reliance Vs Tata Vs Adani: The Most Valued Conglomerate In India Is Worth Over Rs 28 Lakh Crore, WHO IS IT? - Goodreturns","Mon, 29 Jan 2024 08:00:00 GMT"
Engineers in demand: Reliance to hire graduates across business verticals - The Economic Times,"Fri, 12 Jan 2024 08:00:00 GMT"
Mukesh Ambani rejoins $100 billion club as Reliance stock surges record 2.6% - Mint,"Fri, 12 Jan 2024 08:00:00 GMT"
Ram Mandir Inauguration: Reliance announces holiday for all its offices on Jan 22 - The Economic Times,"Fri, 19 Jan 2024 08:00:00 GMT"
"Reliance Jio Q3 net up 12.3% on-yr at Rs 5,208 crore - ET Telecom","Fri, 19 Jan 2024 08:00:00 GMT"
"Reliance Industries celebrates Ram Temple consecration with India, activates special services for devotees & pilgrims - Firstpost","Mon, 22 Jan 2024 08:00:00 GMT"
"Reliance Jio Q3 results: Net profit rises 12.3% to Rs 5,208 crore - Business Standard","Fri, 19 Jan 2024 08:00:00 GMT"
"Q3 Results today: Reliance, HUL, Hindustan Zinc, Paytm, others to announce Q3 earnings - Mint","Fri, 19 Jan 2024 08:00:00 GMT"
"Alok Industries’ Shares Gain Nearly 65% in 5 Sessions Following Rs 3,300 Crore Investment from Reliance - Equitypandit","Mon, 08 Jan 2024 08:00:00 GMT"
"Alok Industries’ shares soar on ₹3,300-cr fund infusion by RIL - BusinessLine","Tue, 02 Jan 2024 08:00:00 GMT"
"Reliance Retail Q3 profit up 31.8% to Rs 3,165 cr; gross revenue at Rs 83,063 cr - ET Retail","Fri, 19 Jan 2024 08:00:00 GMT"
"Reliance Jio Q3 results: Net profit jumps 12% to ₹5,208 crore’ - Fortune India","Fri, 19 Jan 2024 08:00:00 GMT"
Reliance Industries to Unveil New Energy Giga Complex in Gujarat by Late 2024 - Energetica India Magazine,"Mon, 22 Jan 2024 08:00:00 GMT"
"Reliance Was, Is and Always Will Be a Gujarati Company: Mukesh Ambani - Entrepreneur","Wed, 10 Jan 2024 08:00:00 GMT"
Markets surge nearly 1% on HDFC Bank & Reliance Industries boost; Sensex jumps 612.21 points to settle at - Times of India,"Wed, 31 Jan 2024 08:00:00 GMT"
Elkem to acquire REC’s polysilicon unit from Reliance Industries - pv magazine International,"Mon, 22 Jan 2024 08:00:00 GMT"
"Reliance Industries Announces Holiday Across Offices On January 22, Ram Mandir Inauguration Day - India.Com","Sat, 20 Jan 2024 08:00:00 GMT"
"Reliance Industries Q3 Results: PAT Rises 9.3% YoY At Rs 17,265 Crore; O2C Segment Hurts Again - Goodreturns","Fri, 19 Jan 2024 08:00:00 GMT"
"Reliance Jio Q3 Results: Net profit rises 3% QoQ to ₹5,208 crore, ARPU at ₹181.7 - Mint","Fri, 19 Jan 2024 08:00:00 GMT"
Reliance becomes first Indian company to hit Rs 20 lakh crore valuation - Deccan Herald,"Tue, 13 Feb 2024 08:00:00 GMT"
Reliance Industries becomes India's first ₹20 lakh crore company; stock at record high - CNBC TV18,"Tue, 13 Feb 2024 08:00:00 GMT"
"Reliance, Disney sign binding agreement to form JV, to merge media operations in India - The Economic Times","Wed, 28 Feb 2024 08:00:00 GMT"
Disney to Step Back From India in Mega-Deal with Reliance Industries (Published 2024) - The New York Times,"Wed, 28 Feb 2024 08:00:00 GMT"
"Reliance, Disney to merge India media operations; Nita Ambani to be chairperson - The Hindu","Wed, 28 Feb 2024 08:00:00 GMT"
Upcoming IPOs of Reliance Group - Equitymaster,"Sat, 24 Feb 2024 08:00:00 GMT"
What We Know About The $8.5 Billion Disney Merger With Reliance In India - Forbes,"Wed, 28 Feb 2024 08:00:00 GMT"
Reliance-Disney India merger draws Nita Ambani back to business spotlight - Reuters,"Wed, 28 Feb 2024 08:00:00 GMT"
"Reliance makes history, becomes 1st Indian firm to cross Rs 20 lakh market cap - India Today","Tue, 13 Feb 2024 08:00:00 GMT"
RIL to merge Viacom18 with Disney's Star in $8.5bn deal - Times of India,"Thu, 29 Feb 2024 08:00:00 GMT"
Reliance Industries Shares Rise On Merger Deal With Disney - NDTV Profit,"Thu, 29 Feb 2024 08:00:00 GMT"
Reliance Industries: 8 Key reasons why Jefferies has raised earnings estimates and sees more upside for the stock price - Mint,"Tue, 20 Feb 2024 08:00:00 GMT"
"Reliance Industries to establish 50 compressed biogas plants, Rs 5,000 Crore allocated - Manufacturing Today India","Mon, 26 Feb 2024 08:00:00 GMT"
Reliance Industries sitting on a Rs 90-crore loss in this smallcap stock - The Economic Times,"Fri, 16 Feb 2024 08:00:00 GMT"
"Reliance Industries, Disney announce $8.5 billion media joint venture; Nita Ambani to head JV - CNBC TV18","Wed, 28 Feb 2024 08:00:00 GMT"
Nita Ambani likely to be chair of India's merged Reliance-Disney media business - ETHRWorld.com,"Wed, 28 Feb 2024 08:00:00 GMT"
Reliance Industries likely to hit $1 trillion mark in market capitalisation before 2040 - CNBC TV18,"Fri, 16 Feb 2024 08:00:00 GMT"
Believe it or not! Single-day gain in Nvidia stock more than RIL's total market value - The Economic Times,"Fri, 23 Feb 2024 08:00:00 GMT"
Reliance Industries becomes first Indian stock to cross Rs 20 lakh crore market cap - The Economic Times,"Tue, 13 Feb 2024 08:00:00 GMT"
Reliance and 9 IITs set to unveil BharatGPT Hanooman next month: Here's your guide to the new AI model - The Economic Times,"Sun, 25 Feb 2024 08:00:00 GMT"
"Reliance, Disney to merge India media assets to create $8.5 billion powerhouse - Reuters","Wed, 28 Feb 2024 08:00:00 GMT"
"Mukesh Ambani's Reliance Industries is now bigger than Netflix, Accenture - Hindustan Times","Fri, 16 Feb 2024 08:00:00 GMT"
Reliance launches animal welfare initiative ‘Vantara’ - Times of India,"Wed, 28 Feb 2024 08:00:00 GMT"
Nita Ambani likely to be chair of Reliance-Disney’s merged media biz: Report - Business Today,"Wed, 28 Feb 2024 08:00:00 GMT"
RIL Tata JV: Mukesh Ambani’s Reliance mulls buying 29% stake in Tata Play from Walt Disney - Mint,"Thu, 15 Feb 2024 08:00:00 GMT"
Disney and Reliance confirm US$8.5bn Hotstar and Viacom18 merger in India - SportsPro,"Thu, 29 Feb 2024 08:00:00 GMT"
"Reliance Industries to transform 5,000 ICE trucks to hydrogen-powered fleet by mid-2024 - Manufacturing Today India","Mon, 05 Feb 2024 08:00:00 GMT"
"Reliance, Disney announce media assets merger, Nita Ambani to chair venture - Hindustan Times","Wed, 28 Feb 2024 08:00:00 GMT"
Reliance Industries brings eco-friendly innovations to Bharat Tex 2024 - Fibre2Fashion,"Tue, 27 Feb 2024 08:00:00 GMT"
"Reliance Industries Ltd Share Price Highlights: Stock gained 0.88% during today's trading session; Check price range, day's high and low - India Today","Tue, 13 Feb 2024 08:00:00 GMT"
Reliance Industries Ltd becomes India's first to surpass Rs 20 lakh crore in market capitalisation - Firstpost,"Tue, 13 Feb 2024 08:00:00 GMT"
Reliance Industries tops the list of India's most valuable companies in Burgundy Private and Hurun India... - Moneycontrol,"Mon, 12 Feb 2024 08:00:00 GMT"
Reliance Consumer to acquire Ravalgaon Sugar confectionery brands - Business Standard,"Fri, 09 Feb 2024 08:00:00 GMT"
Reliance Industries and Walt Disney announce $8.5 billion merger | Business News - Onmanorama,"Thu, 29 Feb 2024 08:00:00 GMT"
"Reliance-Disney mega $8.5 billion media joint venture 'Epic', say experts - CNBC TV18","Wed, 28 Feb 2024 08:00:00 GMT"
"With Nita Ambani in chair, Reliance sets stage for an $8.5 billion media coup - Business Today","Thu, 29 Feb 2024 08:00:00 GMT"
Disney merges Star India into Reliance Industries' Viacom 18 - The New Indian Express,"Wed, 28 Feb 2024 08:00:00 GMT"
RIL share price hits record high; market cap tops ₹20 lakh crore for first time; what should investors do? - Mint,"Tue, 13 Feb 2024 08:00:00 GMT"
"Reliance Industries is set to launch ‘Hanooman’, a ChatGPT-style AI service - Adda247","Wed, 21 Feb 2024 08:00:00 GMT"
Ambani's quest for green energy can solve stubble-burning problem - The Economic Times,"Mon, 26 Feb 2024 08:00:00 GMT"
Mukesh Ambani's Reliance in talks to buy Tata Play's 30% stake from Walt Disney - Hindustan Times,"Thu, 15 Feb 2024 08:00:00 GMT"
Nita Ambani likely to be chair of India's merged Reliance-Disney media business-sources - Reuters,"Tue, 27 Feb 2024 08:00:00 GMT"
F&O Strategy: Buy Reliance Industries Futures - BusinessLine,"Sat, 10 Feb 2024 08:00:00 GMT"
Reliance becomes first Indian company to hit Rs 20 lakh crore m-cap - The Indian Express,"Wed, 14 Feb 2024 08:00:00 GMT"
"Reliance Industries, Walt Disney announce Rs 70,352 crore media JV, ‘new era,’ says Mukesh Ambani - financialexpress.com","Wed, 28 Feb 2024 08:00:00 GMT"
